,Title,Company,Location,Type,Salary,Contract_type,Job Description
12,"ES Application Developer I,2 or 3",University of Houston,"Houston, TX",Hybrid remote,N,r,"Analyzes, develops and modifies enterprise application programs and ad-hoc programs, under moderate supervision.
Codes, tests, debugs, modifies and troubleshoots enterprise application systems and ad-hoc programs in accordance with standards.
Analyzes complex enterprise application processes and systems and their underlying data structures; identifies and resolves problems.
Installs, tests and troubleshoots interfaces and integration supporting vendor applications.
Assists users with understanding, testing and using enterprise applications and programs. Defines, conducts and monitors system test procedures.
Documents data structures, run streams, applications, programs and other objects according to generally accepted practices.
Uses non-core technologies to design, code, test, debug, modify and troubleshoot enterprise applications.
Learns new technologies and techniques using enterprise development tools.
Performs other job-related duties as assigned.
EEO/AA
Qualifications

Bachelors and No experience up to 5 years experience
Requires a thorough understanding of both theoretical and practical aspects of an analytical, technical or professional discipline; or the basic knowledge of more than one professional discipline. Knowledge of the discipline is normally obtained through a formal, directly job-related 4 year degree from a college or university or an equivalent in-depth specialized training program that is directly related to the type of work being performed. No experience is required up to 5 years of experience.
ES Application Developer 1- Bachelors and no experience
ES Application Developer 2- Bachelors and 3 years of experience
ES Application Developer 3- Bachelors and 5 years of experience

Additional Posting Information:
Preferred Qualifications:
1+ years of experience and/or bachelor’s degree in Computer Science, Engineering, or other technical disciplines.
Experience and/or formal education in one or more of the following: Oracle DB, SQL-Server, UNIX, Windows Servers, imaging, and workflow technologies.
Excellent PeopleTools development skills including Application Designer, Application Engine, PeopleCode, Application Packages, Component Interfaces, Data Mover, SQR, and Query.
Experience designing, developing, and maintaining integration routines among PeopleSoft applications as well as between PeopleSoft and non-PeopleSoft applications using Integration Broker and messages.
Mobile development experience and familiarity with Hyperion and Tableau are a plus.
Excellent analytical and creative problem-solving skills for designing, creating, and testing of software.
Ability to work independently and as part of a team.
Strong in programming fundamentals and have a good understanding of database concepts.
Strong experience in SQL.
Strong troubleshooting skills.
Passion for technology, curiosity, and willingness to constantly learn new skills, work with new tools and discover new and innovative approaches to solving complex technical challenges.

All qualified applicants will be eligible for hybrid remote work.

Salary : Salary commensurate with experience
Required Attachments by Candidate : Resume, Cover Letter/Letter of Application
Employee Status : Regular/Benefits
Job Posting : Mar 13, 2023, 4:14:23 PM"
13,Sr. Software Developer I,iZeal,"Sterling, VA 20165",Onsite,"$119,000 ",r,"iZeal, Inc. has job openings for Sr. Software Developer I. Jobs located in Sterling, VA and various unanticipated locations throughout the U.S. Design, develop, implement, test, and deploy software applications. Research, analyze, and determine information needs and dataflow requirements. Gather and evaluate user requirements and procedures. Travel/relocate to various unanticipated locations throughout the U.S. for long and short term assignments at client sites. Requires Master's degree or foreign equivalent in Computer Science, Engineering (any), or related. Offered salary $119,000 P/Y. Mail resume with cover letter to iZeal, Inc., 46090 Lake Center Plaza, Suite 100, Sterling, VA 20165; Job 20IZI12; EOE"
14,Full Stack Engineer (React/Node.js),Thunkable,"San Francisco, CA",Onsite,"$80,000 - $150,000 ",r,"The Opportunity

You will add to, fix, and maintain features of our product by working on our React based front end, our Node/Express based back end, and our React Native based mobile components.

We’re Looking For Someone Who Has

You enjoy making hard things look easy to usersYou like to write clean, well abstracted code
You have strong communication skills, a positive attitude, and empathy
You are experienced in as many of the following as possible: JavaScript, React, ExpressJS, GraphQL, Node, React Native, Expo, Kubernetes, iOS/Swift, Android/Kotlin
You might not be experienced in all of these technologies, but you are still awesome and should join our team

Bonus:
You created a working app on Thunkable
You have a passion for well designed experiences and good UX
You have experience and interest in QA/Testing
You have experience in small startup environments

Life at Thunkable

Thunkable is on a mission to democratize app development and empower everyone to build without writing a single line of code. Our platform enables anyone to build and publish their iOS and Android apps for free. Today, non-engineers use Thunkable to prototype and share new ideas, develop proofs-of-concept for their own digital business, and design and ship their own ad-supported and premium apps. Thunkable was incubated at Google Research and MIT.

We are backed by Lightspeed, NEA, Owl Ventures, SV Angel, Zhenfund, and Y-Combinator. Our founders are MIT engineers who want to extend the power and fun of creation to people who don’t code.
Joining Thunkable means joining a team of passionate, entrepreneurial and friendly people with different backgrounds, shared ideas, and similar goals.

What will you get when joining our team?

Get compensated: We offer competitive pay, equity and benefits to our employees based on their location. You’ll get access to unlimited PTO regardless of your location.
Wellness and Training Budget: We value your well-being and want to invest in it.
Work Where You Want: The company is based in San Francisco (with an office), but operates globally, with team members working across a number of cities, countries, and time zones (to facilitate async work we prioritize countries and locations in a max 2h time zone difference from those hubs: San Francisco, New York and Dublin)
Shared values: Creativity, Openness, Transparency, Persistence, and Entrepreneurialism.
Challenge yourself by acquiring new abilities, interacting with clients, enhancing products, or learning design. We will encourage you to reach your full potential.

We believe that a diverse and inclusive workplace helps ensure we learn from each other’s different backgrounds, experiences, and perspectives and is critical for building a product that supports the wide range of our users’ needs. Thunkable is an equal opportunity employer and a pleasant and supportive place to work. Women, minorities, individuals with disabilities and protected veterans are encouraged to apply.

This position offers a competitive salary that is based on a combination of factors including location. The salary range for this role in San Francisco is between $80,000 and $150,000 per year and will be based on qualifications and skills. If the successful candidate is located in a different location or country, the salary may vary based on the cost of living, currency and other local factors. We are open to discussing salary with candidates who are interested in the role and may be willing to negotiate based on the candidate's experience and qualifications. We are committed to paying our employees fairly and providing opportunities for professional growth and development."
