,Title,Company,Location,Type,Salary,Contract_type,Job Description
0,Back-End Software Engineer,CVS Health,"Richardson, TX",Onsite,"$70,000 - $140,000 ",r,"This role will work closely with the CVS.com, Marketing,
Specialty and Rx Operations, Caremark.com, Specialty
business and technical teams to deliver functionality for the CVS.com, Caremark.com, specialty.com site. Act as
architect for medium to large projects and drive the design
do solutions for the CVS.com, caremark.com, specialty
business that are cloud native, scalable, maintainable and
reliable. Proactively identify and evaluate emerging
technologies and tools. Work with other senior architects to create the high-level software designs and technical
specifications. Manage the evolution of architectural
roadmaps for your domain, showing how new features are
released or updated, with an eye on paying down technical debt with minimal disruption.
Evaluate package solutions and participate in selection of
solutions to meet business needs and architecture
standards. Provide guidance to developers and other
stakeholders on architectural best practices, guidelines,
and standards. Evangelize, mentor, and coach all on the
same.
Participate in peer reviews on specifications, design and
code. Work with development teams to resolve
development and implementation issues. Work closely with the CVS Online business team and Business Analysts to ensure that requirements are fully understood and
documented in order to deliver quality design deliverables.
Lead Proof-Of-Concepts and Spike Solutions, and provide
“Reference Architectures” and “Baseline Implementations”
when appropriate. Work closely with QA and Operations to
ensure smooth QA and deployment of applications. Work
with project teams to plan integration and implementation
strategies. Communicate very technical material to a non-technical business audience. Provide guidance, direction
and mentorship to Architects.
Provide guidance to developers and other stakeholders
regarding the design of server applications and UI clients,
encompassing APIs and frameworks, micro-services,
containers, databases, cloud infrastructures, and cloud
services, etc.
Responsible for implementation of large systems that
utilize MicroServices , cloud technologies. Apply
knowledge of designing n-tier OO system architecture
using EJB technologies, MicroServices and cloud
technologies. Create architecture and design patterns in
Java, cloud & Microservices. Select, design and implement
Microservices, Content management and Cloud Native
systems.
Ensure all Non-Functional Requirements (e.g.
performance, availability and fail-over, scalability, security,
etc.) are properly articulated, and work with all parties to
guarantee that the software products that are delivered
meet these objectives. Drive buy vs build evaluations,
including consideration of OSS.
Participates in high-level estimation Work closely with
other architects to create and implement new system
designs as well as make improvements to existing
systems. Serve as subject matter expert working with
business stakeholders, architecting use cases relevant to
Digital Pharmacy across multiple enterprise systems.
Collaborate with technical experts to develop solution
during the design phase, enabling the implementation of
final solutions. Ensuring the technical integrity, consistency
and adherence to architectural standards. Implementation
of architectural artifacts depicting the solution consisting of
all necessary integrations and technical components.

Locations: Richardson, TX, Buffalo Grove, IL or Woonsocket, RI

Pay Range
The typical pay range for this role is:
Minimum: 70,000
Maximum: 140,000

Please keep in mind that this range represents the pay range for all positions in the job grade within which this position falls. The actual salary offer will take into account a wide range of factors, including location.

Required Qualifications
3 + years of overall IT/Software Development experience
3+ years of experience with Java, J2EE , Node JS and Spring Boot, Spring data, Spring Batch
2 + years of experience with REST API
2 + years in Logging framework’
2+ years of experience developing microservices and cloud native applications

Preferred Qualifications
A proven track record working as part of a team on large
architectural projects
Experience with distributed caching solutions;
understands the factors that enable effective caching
Exposure to Big-Data and/or Machine Learning
Exposure to CI/CD and DevOps
Experience with SAFe Software Development Principles
Experience in VPC concepts, VPC peering
Experience working on migrations of On-prem to Cloud
Experience with the design and development of complex
systems; employs a disciplined and rigorous approach
Adept at requirements analysis, estimation, systems and
application design, and testing
Experience designing RESTful APIs that facilitate a
superior UX or simplify systems integration.
Familiarity with popular Design Patterns catalogues
Experience with RDBMS and/or NoSQL databases.
Understands the benefits and trade-offs of both. Familiar
with normalization and denormalization, sharding, and
other data-centric patterns
Experience with distributed computing architectures,
including race conditions, parallelism, and concurrency
control
Experience with micro-services
Experience architecting solutions for AWS or Google
clouds
Excellent collaboration, influencing, evangelization,
negotiation, coaching, mentoring, and coalition-building
skills. Ability to work with persons in all job functions (e.g.
product, UX, developers, QA, DevOps).
Excellent verbal and written communications
Ability to manage multiple competing priorities with
minimal supervision. Self-directed
A great team player, with demonstrable experience
delivering superior software products via agile
methodologies
Experience on an Agile team

Education
Bachelor’s degree or equivalent work experience

Business Overview
Bring your heart to CVS Health Every one of us at CVS Health shares a single, clear purpose: Bringing our heart to every moment of your health. This purpose guides our commitment to deliver enhanced human-centric health care for a rapidly changing world. Anchored in our brand — with heart at its center — our purpose sends a personal message that how we deliver our services is just as important as what we deliver. Our Heart At Work Behaviors™ support this purpose. We want everyone who works at CVS Health to feel empowered by the role they play in transforming our culture and accelerating our ability to innovate and deliver solutions to make health care more personal, convenient and affordable. We strive to promote and sustain a culture of diversity, inclusion and belonging every day. CVS Health is an affirmative action employer, and is an equal opportunity employer, as are the physician-owned businesses for which CVS Health provides management services. We do not discriminate in recruiting, hiring, promotion, or any other personnel action based on race, ethnicity, color, national origin, sex/gender, sexual orientation, gender identity or expression, religion, age, disability, protected veteran status, or any other characteristic protected by applicable federal, state, or local law. We proudly support and encourage people with military experience (active, veterans, reservists and National Guard) as well as military spouses to apply for CVS Health job opportunities."
1,IT Developer II - Software Tester AET,AGCO,"Tremont, IL",Remote,N,r,"IT Developer II – Software Tester AET

Who We Are Looking For:

At AGCO, we believe that when our employees succeed, our business succeeds. It is a people philosophy that we believe and invest in. We make sure all of our employees – in every function, every geography and at every level – have the tools they need to be successful and take charge of their career. Because when our people grow, our business grows. Every day. Every way.

AGCO, a global leader in the design, manufacture, and distribution of agricultural solutions, has an exciting career opportunity for an IT Developer II to join our team.

Working in a DevOps approach, the IT Developer II is responsible for testing and test automation of new connected vehicle products as well as updating existing products, to deliver event-driven micro-services in a streaming ecosystem. With a focus on rapid, iterative delivery of professional software to prove specific business hypotheses, this position will participate in the design, building, and operation of production deployments that provide value to internal and external customers.

This position is available for remote work.

What You Will Do:

Work with product owners and/or other development team members to groom new features and user stories needed in applications/services.
Test and validate new or updated features and provide support for applications in production to maintain uptime.
Participate in team ceremonies including planning, grooming, product demonstration and team retrospectives.
Demonstrate the ability to adapt and work with team members of various experience levels.
Contribute to process improvement and coding standards.
Provide feedback and mentoring to junior developers in your areas of expertise.
Evaluate new features and solutions in partnership with Solution Architects and team members for logic fallacies before implementation.
Resolve incidents and complete service requests to the agreed service levels (SLA)
Monitor performance and provide responsive action to issues maintaining high-level internal customer satisfaction to required service level performance measures, through the successful resolution of customer requests/issues/change requests.

What You Will Bring:

A Bachelor's degree in Computer Science or related Engineering with 5+ years of relevant Software Test/Automation experience
Experience with GIT and working with CI/CD toolchains, Javascript, Python, Pytest
Ability to create and manage test cases.

A Plus If You have:

Knowledge of SAFe/Agile software methodologies is a plus.
Cloud platform (AWS, Azure, GCP) experience is a plus.

Travel Required:

Work requires occasional global travel to meetings, AGCO site visits, vendor/partner site visits and conferences, expected to be 5% or less.

What We Offer:

Experience our global diversity and enterprising spirit while helping us create innovative technologies and a positive impact that helps feed the world’s eight billion people. From the day you decide to join AGCO, we want to engage and excite you and we are clear on where we want to go as a business, and we trust you to help us there. Whether you want to learn a new skill or aspire to do something different, we can help you develop the skills you need to take your career - and our business - to the next level.

We also invite you to “Make the Most of YOU” - Benefits include: health care and wellness plans, flexible and virtual work options (where available), 401(k) Savings Plan with company match, paid holidays and paid time off, flexible spending accounts, reimbursement for continuing education, company philanthropic programs, company rewards programs, and much more…

Please note that this job posting is not designed to cover or contain a comprehensive listing of all required activities, duties, responsibilities, or benefits and may change at any time with or without notice.

AGCO is proud to be an Equal Opportunity Employer.
We maintain a drug-free workplace and perform pre-employment substance abuse testing.

AGCO is a global leader in the design, manufacture, and distribution of agricultural engineering with a portfolio of exciting international brands which deliver solutions to farmers in 140 countries through a full line offer from tractors and combine harvesters to protein production systems and smart farming software solutions – to an environment where the future is happening now. Join us as we bring agriculture into the future."
2,Software Engineering Manager,Paramount+,"New York, NY 10036",Remote,"$150,000 - $180,000 ",r - Full-time,"Paramount+, a direct-to-consumer digital subscription video on-demand and live streaming service from Paramount Global, combines live sports, breaking news, and a mountain of entertainment. The premium streaming service features an expansive library of original series, hit shows and popular movies across every genre from world-renowned brands and production studios, including BET, CBS, Comedy Central, MTV, Nickelodeon, Paramount Pictures and the Smithsonian Channel. The service is also the streaming home to unmatched sports programming, including every CBS Sports event, from golf to football to basketball and more, plus exclusive streaming rights for major sports properties, including some of the world’s biggest and most popular soccer leagues. Paramount+ also enables subscribers to stream local CBS stations live across the U.S. in addition to the ability to stream Paramount Streaming’s other live channels: CBSN for 24/7 news, CBS Sports HQ for sports news and analysis, and ET Live for entertainment coverage.

The team for Paramount+ is responsible for servicing Paramount’s premium online content around the world. We’re home to exclusive shows (Tulsa King, 1923, all the Star Treks, The Good Fight) and movies (Top Gun: Maverick) while helping millions of viewers consume and enjoy content across all of Paramount’s global brands (such as Nickelodeon, Comedy Central, Smithsonian, MTV, BET, etc).

Role Details:
We are looking for dependable and proactive engineering managers with many years of proven leadership skills. Engineering managers will lead multiple projects, build and coordinate diverse teams of engineers from different disciplines, formulate and implement strategies, and cooperate with other managers.
To be successful as an engineering manager, you should have exceptional foresight, excellent communication skills, working knowledge of different engineering subject areas, and the skills for managing risk. Ideally, candidates will have both good supervisory skills and technical understanding, and an appreciation for the complex and fast-paced nature of the industry. Your Day-to-Day:

Set and communicate team priorities that support the broader organizations goals. Align strategy, processes, and decision-making across teams!

Set clear expectations with individuals based on their level and role and aligned to the broader organization’s goals. Meet regularly with individuals to discuss performance and development and provide feedback and coaching!

Help ensure teams are on track with target deliveries, identify and communicate any risks.

Help the team to adhere to long-term vision and roadmap within, and larger prioritized goals of the organization.

Help ensure team quality engineering standards are kept throughout the team Basic Qualifications:

BS degree in Computer Science or equivalent practical experience.

5+ years of engineering experience.

3+ years serving as a team lead of engineers.

5+ years of Object Oriented programming experience(Java preferred), Linux environment.

5+ years of experience with Spring/Spring Boot Additional Qualifications:

Excellent communication and leadership skills, with the ability to effectively manage and motivate a team of engineers.

Ability to prioritize projects and delegate tasks appropriately.

MS degree in Computer Science or similar subject area

Understanding of billing platforms (ITunes, Google Play, Stripe, Recurly, Roku, etc.)

#LI - NS1
#LI - Remote

ADDITIONAL INFORMATION

Hiring Salary Range: $150,000.00 - 180,000.00.

The hiring salary range for this position applies to New York City, California, Colorado, Washington state, and most other geographies. Starting pay for the successful applicant depends on a variety of job-related factors, including but not limited to geographic location, market demands, experience, training, and education. The benefits available for this position include medical, dental, vision, 401(k) plan, life insurance coverage, disability benefits, tuition assistance program and PTO or, if applicable, as otherwise dictated by the appropriate Collective Bargaining Agreement. This position is bonus eligible.

https://www.paramount.com/careers/benefits

Paramount is an equal opportunity employer (EOE) including disability/vet.

At Paramount, the spirit of inclusion feeds into everything that we do, on-screen and off. From the programming and movies we create to employee benefits/programs and social impact outreach initiatives, we believe that opportunity, access, resources and rewards should be available to and for the benefit of all. Paramount is proud to be an equal opportunity workplace and is an affirmative action employer. We are committed to equal employment opportunity regardless of race, color, ethnicity, ancestry, religion, creed, sex, national origin, sexual orientation, age, citizenship status, marital status, disability, gender identity, gender expression, and Veteran status.

If you are a qualified individual with a disability or a disabled veteran, you may request a reasonable accommodation if you are unable or limited in your ability to use or access. https://www.paramount.com/careers as a result of your disability. You can request reasonable accommodations by calling 212.846.5500 or by sending an email to viacomaccommodations@viacom.com. Only messages left for this purpose will be returned."
3,Software Developer,"Torch Technologies, Inc.","Huntsville, AL 35802",Onsite,Full-time,Full-time,"Job Description:

Torch Technologies, a 100 percent employee-owned company, is seeking a professional Software Developer to join a team currently developing spatial computing and advanced visualization applications. Candidates applying for this position will have the opportunity to build and integrate server-side software technology with visualization products for educating and training soldiers, sailors, airmen, marines, and civilians.

The candidate selected for this position will be a member of an agile development team working closely with other developers, artists, and subject matter experts. The ideal candidate must be able to work well within a multi-disciplinary collaborative team environment. The teams are developing a virtual training device framework and customer applications using the framework.

Expectations and Responsibilities:
As a member of the Advanced VizLab Team, you are expected to be a positive, pro-active, and contributing team member.
You will collaborate daily with fellow developers, artists, and subject matter experts to develop top-tier training products for military and commercial customers.
You will contribute to projects built primarily in C# using .Net Core with Visual Studio. The applications leverage a range of technologies including JavaScript, Electron JS, and Material libraries.
You will be responsible for executing all aspects of the Software Development Life Cycle (SDLC) including documentation and troubleshooting as a full stack developer.
Everyone on the team is expected to write well-designed (SOLID), testable code and we work together as a team to help make that happen.
Everyone on the team conducts peer reviews including detailed feedback.
You will develop flowcharts, layouts, and documentation to identify requirements for new features, as well as extending and refactoring existing capabilities.



Personal Requirements:
Must be a team player and know the importance of listening to others.
Be a positive, active, and contributing member of the team.
Must be able to effectively communicate in verbal and written form.
Must be proactive and help with problem-solving.
Excited to learn new technologies and improve the solutions under development.
US Citizenship is required for this position.
Eligibility to obtain a United States SECRET clearance is required for ongoing employment in this position.
Technical Requirements:
Bachelor’s degree in Computer Science or Software Engineering and 2 years of experience.
Basic understanding of software engineering and up to date on best practices.
Basic understanding of Scrum framework.
Basic understanding of JavaScript, HTML5, SQL and one of the following languages: C#, Java, C++.
Desired but Not Required Experience:
Basic understanding or experience with writing Unit Tests.
Basic understanding or experience with Docker & micro-services.
Basic understanding of git and software version control.
Interest in DevOps, Cloud Technologies (Azure), and System Architecture."
4,Full Stack Javascript Engineer (Remote\WFH),IQVIA,Remote,Onsite,Full-time,Full-time,"You will be part of a growing team of engineers, focused on building new and modern software that’s positioned to revolution the clinical trial space. In this remote (WFH-based) role, you’ll be empowered and encouraged to think “outside the box” to develop innovative solutions to drive business and the industry forward. You love the idea of owning a product, from developing new features to scaling to meet market demands. Not only are you an expert in working in JavaScript environments but you have a desire to get out of you comfort zone and grow as an engineer.

We’re seeing immense growth in the industry, and our core focus is scaling our product’s feature set to meet that growth. Bring your talent and drive to our team of passionate, creative, and innovative thinkers, focused on developing a sophisticated product that uses modern JavaScript. We have the support and resources of a large company but operate with a start-up culture. You’ll thrive in a fast-paced and agile environment, during which you will see real-time results. As we work to rapidly expand our team, you’ll have the opportunity to grow your career in the direction that’s right for you.

RESPONSIBILITIES:
Serve as critical development resource on cross platform mobile application
Work collaboratively and efficiently across functional teams in a fast-paced startup-like environment.
High standard of engineering quality through source control, code reviews, continuous integration, and unit tests.
Extend our platform to handle an expanding set of features.
Improve infrastructure and application development
Review and refactor legacy code
Provide input on the establishment of development best practices and standards for the organization

MUST HAVE SKILLS:
3+ years experience as a software engineer
Software development experience: JavaScript/TypeScript
Developing and maintaining RESTful APIs with Node.js / Express.js
Experience with SQL databases (SQLite/Postgres)
Experience with React (React/Redux)

NICE TO HAVE SKILLS:
Experience with React Native is a plus
Experience with Swift, Objective-C, Java, and Kotlin are a plus
Experience with mobile application deployments (Android/iOS) are a plus
Experience with data/event streams (Amazon Kinesis/Apache Pulsar) are a plus
Familiarity with a CI/CD tool (CircleCI/AWS CodePipeline) are a plus
Experience with cloud platforms (AWS) are a plus
IQVIA is a leading global provider of advanced analytics, technology solutions and clinical research services to the life sciences industry. We believe in pushing the boundaries of human science and data science to make the biggest impact possible – to help our customers create a healthier world. Learn more at https://jobs.iqvia.com
We are committed to providing equal employment opportunities for all, including veterans and candidates with disabilities. https://jobs.iqvia.com/eoe
As the COVID-19 virus continues to evolve, IQVIA’s ability to operate and provide certain services to customers and partners necessitates IQVIA and its employees meet specific requirements regarding vaccination status. https://jobs.iqvia.com/covid-19-vaccine-status"
