,Title,Company,Location,Type,Salary,Contract_type,Job Description
5,"Sr. Software Developer, PHP",CustomInk,Pennsylvania,Onsite,"$110,000 - $150,000 ",r - Full-time,"This is a unique ground-floor opportunity for a highly motivated and resourceful person to be a leader on our engineering team. In this role, you'll be involved in every aspect of our product from what we build to how we build it. You'll maintain and grow our current platform while building out our RESTful API allowing us to completely re-architect our application's structure. Printfection has a small-team focus, and this position will be reporting directly to the Head of Engineering.
US Residents Only
Responsibilities:
Build a PHP-based RESTful API core to decouple UI and business logic to set up seamless growth of our innovative platform serving enterprise-level customers.
Ensure consistency and scalability with a focus on simplicity, centralized assets and documentation.
As a member of our growing Platform Team, you'll play an integral role in growing and scaling the core Printfection SaaS platform.
Work closely with other members of the team to learn the current platform and assist in the transition to a hub and spoke model - modularized - micro services architecture
Ensure the long-term quality, security, and scalability of our platform.
Requirements:
You’re a software developer with at least 6 years of professional experience working with PHP and on a large-scale web application and RESTful APIs with Linux and MySQL experience.
You have experience in building applications using secure coding principles and practices and have the architectural vision of proactively designing for security principles such as least privilege, separation of privilege and accountability among others.
Proficiency with AWS, Docker, JavaScript and CSS and have the confidence to step into the frontend to keep yourself unblocked.
Proficiency with Linux command line server administration is a plus.
Understanding of Infrastructure as Code / Automation / Scripting - Ansible/Terraform
You pride yourself on polished, easy-to-understand written and verbal communication and care just as much about the readability and simplicity of your code as you do about solving the problem.
You're a team player who looks to make others and what we work on better.
You've been responsible for the success of an application.
Experience with a transitioning legacy code base and systems, to modern fluid systems.
Experience in remote work and cultural environments.
You have a deadline mentality, are detailed-oriented, and have a passion for building things that scale.
Salary Range: $110,000 - $150,000
Cover letters are preferred (not required), Custom Ink values individuality, so use your judgment and write to us in your own voice.
CustomInk, LLC (""""Custom Ink"""") is an Equal Opportunity Employer. We celebrate diversity in all forms and are committed to maintaining a discrimination-free workplace that treats applicants and employees with dignity and respect. Our employment process is conducted without regard to race, color, religion, nationality or ethnic background, sex, pregnancy, sexual orientation, gender identity or expression, age, disability, protected veteran status, genetic information, or other attributes protected by state, federal, and local law.

Custom Ink uses E-Verify to confirm the employment eligibility of all new team members. To learn more about E-Verify, including your rights and responsibilities, please click
here
.
Read about our commitment to the safety of our team members during COVID-19
here
."
6,Software Developer,DHL eCommerce,Remote,Onsite,N,r - Full-time,"Job Brief
The Software Developer will be responsible for translating high level business requirements into fully functional code. Manage requirements and scope to ensure delivery of functionality in time for DHL eCommerce Solutions with high quality.
SUMMARY:
The Software Developer will be responsible for translating high level business requirements into fully functional code. Manage requirements and scope to ensure delivery of functionality in time for DHL eCommerce Solutions with high quality.
ESSENTIAL DUTIES AND RESPONSIBILITIES:
Provide technical subject matter expertise to software development teams responsible for systems designs.
Coordinate with teams across the enterprise on the migration of existing IT services to the cloud; identify technical requirements, security requirements, potential issues, and work through these challenges.
Participate and support agile software development while working with Developers, Database Developers, Business Analysts and other departments to architect and implement new functionality.
Develop moderate application solutions by analysing and breaking down of system requirements.
Responsible for quality control of all development deliverables.
Develop, maintain and implement standards and methodologies for software development.
Responsible for interpreting system requirements to design and application teams.
Transform system requirements into technical design and application code base.
Independently analyse medium to moderately complex system requirements and translate to industry standard technical design.
Estimate development effort in support of project requests, based on documentation provided.
Participate in code quality checks through reviews and code quality tools.
Perform other related duties as required.
EDUCATION AND/OR EXPERIENCE:
Bachelor’s degree in Computer Science or related field.
5-6 years of experience in a directly related field.
REQUIREMENTS/SKILLS:
Required Technology Skills
Expert in Cloud-Native Development, proficient in JDK 11, Spring Boot 2.x, Spring Cloud, Spring Batch and Integration using Microservice architecture
Well versed with OOPS design concepts and good grasp of architectural patterns
Hands-on experience with unit testing/integration testing tools like Mockito, RestAssured, Cucumber.
Familiarity with event driven architecture patterns.
Git/Maven expertise.
Working experience in building Images and Containerization using Docker, Docker Engine using an orchestration system like Kubernetes/Openshift
Expert in designing and developing RESTful APIs, schemas, documentation using tools like Swagger and dev testing using tools like Postman
Knowledge of modern microservices security practices like OAuth2
Microservices caching patterns
Experience analysing/tuning microservices performance
Ability to align workday with US Eastern Time Zone.
Nice To Have Technology Skills
Experience working with web servers such as, Nginx and Apache
Master level knowledge of SQL language, triggers, views, stored procedures and complex SQLs under Oracle or other RDBMS systems.
Experience building and deploying projects using CI/CD tools such as Jenkins
Knowledge on transforming a legacy monolithic application to a Microservice based application
Experience in designing, building and running load tests using applications such as Locust or JMeter
Building and managing support and monitoring dashboards for high-volume APIs using tools such as ELK or Splunk stack
Experience in Angular and/or React would be a plus.
Familiarity with NoSql databases would be beneficial.
API Integration Layer experience.
Other Skills
Experience with Agile Software Development practices using tools like JIRA/Confluence.
Proven expertise troubleshooting and solution design for complex issues.
Apply critical thinking skills, experience, and research sources in the design and implementation of technical solutions which improve usability, analyse maintainability, and scalability.
Ensure best practice use of applications by keeping abreast with emerging technologies to ensure optimal performance of the applications.
Strong emphasis on code quality, peer reviews, and writing test-driven code
Ability to create technical specifications, architecture diagrams, network diagrams, data models, object diagrams, process flows and application development artifacts
Experience developing on a full project life cycle, from requirements to delivery
Excellent Planning & Organizational skills
Excellent communication, documentation skills plus team leadership skills.
Ability to research new technologies and create conceptual models or solutions and present them to high-level audience across business, application and technology domains.
Proven experience with TDD, and ability to mentor others in effective TDD
PHYSICAL DEMANDS:
Physical demands are consistent with a professional office setting.
Regular sitting at work station for 25 – 75% of the work shift.
Ability to work alternate shifts (<20%).
Equal Opportunity Employer- Veterans/Disability"
7,Software Engineer,"Spry Squared, Inc.","Englewood, CO",Onsite,"$80,000 - $100,000 ",ct,"Company Description

Spry Squared is a Minority and Woman Owned Small Business headquartered in Denver, Colorado with offices across the United States of America. We are an experienced federal government and commercial service provider with security cleared personnel working on various projects across the USA and the globe.
Spry Squared provides organizations with Best in Class Enterprise Solutions, Managed IT Services, Cybersecurity Solutions, IT Professional Services, Recruiting Services, Project/Program Management and technology products. We are your strategic partner and value-added reseller, solving complex business challenges by leveraging technology solutions that reduce costs, optimize productivity and minimize risk.

Job Description

Do you want to solve complex problems and build systems that will change the Internet? Do you want to be part of a company that is on the cutting edge of technology? Do you want to work with a world-class team of engineers? Do you have what it takes?
The engineering team at our client is looking for a software engineer focusing on developing software for a highly scalable distributed networked applications. We are looking for extremely motivated engineers who can work collaboratively to help build carrier-grade networking infrastructure.
RESPONSIBILITIES:
Design and develop software for large-scale, distributed systems and services
Develop software for scalable real time, fault tolerant, high throughput message and event driven systems
Improve the performance of existing software
Analyze and troubleshoot software application issues in a timely fashion
Mentor other engineers to maintain architectural vision and software quality
Supervising and overseeing the technical aspects of projects

Qualifications
B.S or M.S. in Computer Science, Electrical Engineering, Computer Engineering, or a related technical field
7+ years experience developing large-scale software systems
Computer Science fundamentals in object-oriented design
Computer Science fundamentals in data structures
Computer Science fundamentals in algorithm design, problem solving, and complexity analysis
Through understanding of IP networking and socket-based programming
High degree of competency working with multi-threaded development
Excellent C++ developer and debugging skills
Ability to deliver clean, modular code quickly and efficiently
Experience developing on Linux OS
BONUS POINTS:
Working experience with C++ 11 through 17
Experience developing cloud applications.
Experience with Test Driven Development and Continuous Integration
Knowledge of Python and Go
Sense of humor

Additional Information

All your information will be kept confidential according to EEO guidelines.
Salary:
$80,000 - $100,000 annually Depending on Experience"
8,"Software Engineer, Testing",CBOE,"Kansas City, MO",Remote,"$80,000 - $130,000 ",r - Full-time,"Job Description
Job Description
We’re looking for talented developers who have a passion for quality.
Responsibilities:
The primary responsibility of this developer, tester, quality assurance, and software engineer is to work with our real time trading systems and write automated code/tests to evaluate and analyze new functionality. More specifically, this role will focus on building tests and testing tools supporting our world-class, highly scalable data platform. They will also have the opportunity to develop and improve our proprietary automated test frameworks. The role will work directly with our product owners and other development teams to test and validate new features which includes identifying, reporting, and driving resolution on issues discovered.
Requirements:
Bachelor’s Degree in Computer Science, Engineering, related fields, or equivalent experience.
At least three years of development or QA experience is required, with recent and demonstrable experience creating automated test cases and working with test frameworks. Experience with continuous integration systems is a plus.
Strong experience in object-oriented design and programming techniques. Our preference is someone with Python or C# development experience or a working knowledge of other programming languages.
SQL experience (PostgreSQL or other variety) is necessary.
Comfortable with working in a Linux/Unix terminal.
Desired Skills:
Experience in the financial markets is a plus.
Experience with the complete software development life cycle and QA processes in an Agile environment.
Experience with MS Windows and Office tools.
The successful candidate will have excellent analytical skills, an exacting attention to detail, and an ability to work collaboratively and communicate effectively within a cross functional team environment.
The Cboe Experience
Whether you are just beginning your career or are a senior-level professional, working at Cboe will offer you countless opportunities to develop skills, make an impact through meaningful contributions, and gain rich experiences at an accelerated pace. By working collaboratively with smart, genuine and hardworking colleagues, you will build enduring relationships through frequent collaboration that will serve you well throughout your career, regardless of your chosen path. And, along your exceptional career journey at Cboe you’ll receive amazing benefits and robust rewards.
As required by the New York City Human Rights Law, Cboe provides a reasonable range of minimum base salary for roles that may be performed in New York City. Actual compensation is influenced by a wide array of factors including but not limited to geographic location, skill set, level of experience, etc. For New York City only, the range of starting base salary for this role is $80,000-$130,000. Additional incentive compensation and benefits may be available.

Equal Employment Opportunity
We're proud to be an equal opportunity employer - and celebrate our associates' differences, including race, color, religion, sex, sexual orientation, gender identity, national origin, age, disability, and Veteran status.
#LI-CP1
#LI-Remote

Any communication from Cboe regarding this position will only come from a Cboe recruiter who has a @cboe.com email or via LinkedIn Recruiter. Cboe does not use any other third party communication tools for recruiting purposes."
9,TYpescript - Developer (Full Stack) (Mid),Bayer,"Ankeny, IA 50021",Onsite,Contr,ct,"This group runs the IT systems for greenhouses worldwide. You can provide this link to your candidates to better understand the function of the group: https://www.youtube.com/watch?v=67erTfnzE0Y

Full Stack Developer (Node/React)
Work in a fast-paced R&D environment
Create webpages using Typescript, Node, and React to interact with automated machinery
Design databases and JSON APIs
Provide feedback in the product design and specification process
A wide degree of creativity and latitude is expected
Responsible for code development, debugging, analyzing test results, implementation, support, and enhancement of automated system software programs used in agricultural research.

Required Qualifications
Minimum of 5 years experience in a programming field, database design, or server administration
Proficient in programming JavaScript/Typescript with 2+ years experience
Proficient in SQL Query Development, Relational Database Design
Proficient in JSON API development
Requires a bachelor's degree in Computer Science or similar bachelor's degree
Good verbal and written communication skills
This developer position is located on-site in Ankeny, IA

Preferred but not required qualifications
Agile development environment
Git source control experience
Continuous Integration tools

Filtered required in Javascript (Typescript) filtered test

Role will be onsite,
Location is Ankeny, Iowa Onsite 2-3 days/week

Candidates will also do a live code test during the interview.

IMPORTANT NOTE for POTENTIAL US CANDIDATES: Bayer expects its colleagues to be fully vaccinated against COVID-19. Bayer defines fully vaccinated in alignment with CDC which is two weeks after completing the two-dose vaccine regimen or two weeks after completing the one-dose regimen. Additionally, Bayer colleagues are also required to comply with state, local and customer requirements."
10,Web Developer (Angular),"CleanAir Engineering, Inc.","Palatine, IL 60067",Onsite,N,ct,"WEB DEVELOPER (Angular)
Are you looking for an opportunity to use your talents working with a leader in the air quality industry? CleanAir Engineering, Inc. is a global leader providing measurement services, consulting, and automated cloud-based equipment solutions for industrial facilities. We are currently looking for a Web Developer for our Internet of Things Team. This is a unique position that will have the feel of working for a tech start-up but within a company that’s been a leader in air quality measurements for over 45 years.
The Angular Web Developer will be responsible for building custom front end web application features for internal and external users. Our ideal candidates will love to learn and expand their skillsets, build new products, and experiment with ways to improve our development processes and pipelines. You will be able to spend 10% of your time on training/side projects.
Required Job Qualifications:
1+ years Angular experience (Angular 2 or newer)
Experience with CI/CD
Experience with component libraries (e.g., Material, Bootstrap)
Self-motivated individual with interest in developing functional specifications for new features
Possess a learning and growth mindset
Preferred Job Qualifications:
AWS experience (S3, Cloudfront, Cognito, Severless)
Experience building progressive web applications preferred.
Benefits:
Salary plus ATO **, superior medical insurance, 401K, prescription drug plan, short and long term disability, tuition reimbursement, vacation pay and life insurance. Salary commensurate with experience
**Accumulated Time Off - approved hours beyond 40/week are provided as additional paid time off that, in select situations, can be exchanged for additional compensation.
Candidates must pass a drug screen and a criminal background check
To submit an application, please click the “Apply for Job” button below.
Clean Air Engineering is an equal opportunity employer, offering challenging career opportunities, training, competitive compensation and a drug-free/smoke-free working environment."
11,"Software Engineer, Security Analysis & Assurance",Zoox,"Foster City, CA",Onsite,"$187,000 - $241,000 ",r,"The Security Software Development & Analysis (SSDA) team is a subteam within ProdSec aiming at improving the security posture of Zoox robotaxi service through the development of security-critical software for vehicle platform & backend infrastructure. Including defining security requirements for individual vehicle components as well as their integrated subsystems. Engineers will also be responsible for
developing software tools, frameworks, and processes for constructing security assurance cases; providing evidence & grounds for confidence that a set of intended security controls on vehicle subsystems are effective in their application.

Required Qualifications
Strong background in systems security, threat modeling, security risks identification, analysis, and prioritization
Experience with defining security requirements for networked embedded systems
Strong background in network security and network programming
3+ years of programming experience in production environments
B.S Degree in computer science, computer engineering, or a related field
Strong written and verbal communication skills
Local to San Francisco Bay Area or willing to relocate
Bonus Qualifications
Penetration testing and/or Quality Assurance experience
Background in the Automotive industry
Master’s or Ph.D. degree in computer science or computer engineering
Compensation

There are three major components to compensation for this position: salary, Amazon Restricted Stock Units (RSUs), and Zoox Stock Appreciation Rights. The salary range for this position is $187,000 to $241,000. A sign-on bonus may be offered as part of the compensation package. Compensation will vary based on geographic location and level. Leveling, as well as positioning within a level, is determined by a range of factors, including, but not limited to, a candidate's relevant years of experience, domain knowledge, and interview performance. The salary range listed in this posting is representative of the range of levels Zoox is considering for this position.
Zoox also offers a comprehensive package of benefits including paid time off (e.g. sick leave, vacation, bereavement), unpaid time off, Zoox Stock Appreciation Rights, Amazon RSUs, health insurance, long-term care insurance, long-term and short-term disability insurance, and life insurance.

Vaccine Mandate
Employees working in this position will be required to have received a single dose of the J&J/Janssen COVID-19 vaccine OR have completed the two-dose Pfizer or Moderna vaccine series. In addition, employees will be required to receive a COVID-19 booster vaccine within two months of becoming eligible for the booster vaccine.

Employees will be required to show proof of vaccination status upon receipt of a conditional offer of employment. That offer of employment will be conditioned upon, among other things, an Applicant’s ability to show proof of vaccination status. Please note the Company provides reasonable accommodations in accordance with applicable state, federal, and local laws.

About Zoox
Zoox is developing the first ground-up, fully autonomous vehicle fleet and the supporting ecosystem required to bring this technology to market. Sitting at the intersection of robotics, machine learning, and design, Zoox aims to provide the next generation of mobility-as-a-service in urban environments. We’re looking for top talent that shares our passion and wants to be part of a fast-moving and highly execution-oriented team.

Follow us on LinkedIn

A Final Note:
You do not need to match every listed expectation to apply for this position. Here at Zoox, we know that diverse perspectives foster the innovation we need to be successful, and we are committed to building a team that encompasses a variety of backgrounds, experiences, and skills."
