,Title,Company,Location,Type,Salary,Contract_type,Job Description
19,SOFTWARE DEVELOPER,Capgemini,"Des Plaines, IL",Onsite,Contr,ct,"Duration: 9+ months

Job Description:

Knowledge in Salesforce marketing cloud platform and product.
Experience in SFMC programming languages like AMP Script and SSJS. Knowledge in Rest API

The Capgemini Freelancer Gateway is enabled by a cutting-edge software platform that leads the contingent labor world for technology innovation. The software platform leverages Machine Learning and Artificial Intelligence to make sure the right people end up in the right job.

A global leader in consulting, technology services and digital transformation, Capgemini is at the forefront of innovation to address the entire breadth of clients’ opportunities in the evolving world of cloud, digital and platforms. Building on its strong 50 year heritage and deep industry-specific expertise, Capgemini enables organizations to realize their business ambitions through an array of services from strategy to operations. Capgemini is driven by the conviction that the business value of technology comes from and through people. It is a multicultural company of over 200,000 team members in more than 40 countries. The Group reported 2018 global revenues of EUR 13.2 billion."
20,Software Developer,Lawrence Livermore National Laboratory,"Livermore, CA 94550",Onsite,"$103,290 - $139,128 ",r - Full-time,"Company Description
Join us and make YOUR mark on the World!
Are you interested in joining some of the brightest talent in the world to strengthen the United States’ security? Come join Lawrence Livermore National Laboratory (LLNL) where our employees apply their expertise to create solutions for BIG ideas that make our world a better place.
We are committed to a diverse and equitable workforce with an inclusive culture that values and celebrates the diversity of our people, talents, ideas, experiences, and perspectives. This is essential to innovation and creativity for continued success of the Laboratory’s mission.
Pay Range
$103,290.00 - $139,128.00 Annually for the SES.1 level and $123,960.00 - $166,992.00 Annually for the SES.2 level

Please note that the pay range information is a general guideline only. Many factors are taken into consideration when setting starting pay including education, experience, the external labor market, and internal equity.
Job Description
We have multiple openings for Software Developers with a combination of education and experience commensurate with supporting a variety of software development assignments. The selected candidates will work on multi-disciplinary teams in an environment that encourages the support of the academic research community while focusing on problems of interest to LLNL and DOE programs as a member of a dynamic, multidisciplinary team environment. These positions will be within a group in the Computing Directorate.
This position will be filled at either level based on knowledge and related experience as assessed by the hiring team. Additional job responsibilities (outlined below) will be assigned if hired at the higher level.
In this role you will
Provide computer science and software development support using industry standard software development practices and modern programming languages and operating systems.
Develop a range of applications including scientific, graphical user interface, database, and visualization applications on UNIX platforms.
Participate in the requirements definition, analysis, design, implementation, debugging, testing, and optimization of computer programs on workstations.
Participate on a research team to support work and research papers.
Contribute to the fulfillment of technical projects and organizational objectives, functioning as an effective team member on multi-disciplinary teams.
Engage other developers frequently to share relevant knowledge, opinions, and recommendations.
Perform other duties as assigned.
Additional job responsibilities, at the SES.2 level
Design, implement, deploy, and maintain software systems using object-oriented analysis, design, and programming techniques.
Provide solutions to moderately complex problems involving largely identifiable factors.
Qualifications
Bachelor’s degree in computer science, computer engineering, or a related field, or the equivalent combination of education and related experience.
Skilled in all aspects of software project life cycle: feasibility, requirements, design, implementation, integration, test and deployment.
Experience developing software with either Python, C++ or JAVA within Linux, UNIX, and/or Windows environments.
Ability to effectively manage concurrent technical tasks with competing priorities and meet deadlines that are important to project success.
Experience approaching difficult problems with enthusiasm and creativity.
Effective interpersonal skills necessary to interact with all levels of personnel with the ability to work independently in a multi-disciplinary team environment.
Effective written and verbal communication skills to prepare, present, and document technical information.
Additional qualifications at the SES.2 level
Ability to work effectively with minimal guidance.
Experience providing innovative approaches and applying new technologies to broadly defined tasks and projects.
Broad experience applying effective analytical and problem-solving skills to moderately complex problems.
Qualifications We Desire
Master’s Degree in Computer Science or related field.
Experience with Perl, Web Technologies, Ajax, or HTML5, Oracle database schema design and SQL, distributed control systems, real-time operating systems, Big Data analytics, NAS, platforms, resource management systems, Linux virtualization, cloud computing technologies, grid frame works, and cloud file systems, revision control systems, remote boot protocols, and/or experience in a High Performance Computing environment.
Experience with application development using object oriented methods, an understanding of fundamental networking and distributed computing concepts, and/or experience maintaining a High Performance Computing system.
Additional Information
All your information will be kept confidential according to EEO guidelines.
Position Information
This is a Career Indefinite or At Will appointment. Lab employees and external candidates may be considered for this position.
Why Lawrence Livermore National Laboratory?
Flexible Benefits Package
401(k)
Relocation Assistance
Education Reimbursement Program
Flexible schedules (*depending on project needs)
Inclusion, Diversity, Equity and Accountability (IDEA) - visit https://www.llnl.gov/diversity
Our core beliefs - visit https://www.llnl.gov/diversity/our-values
Employee engagement - visit https://www.llnl.gov/diversity/employee-engagement
Security Clearance
This position requires a Department of Energy (DOE) Q-level clearance. If you are selected, we will initiate a Federal background investigation to determine if you meet eligibility requirements for access to classified information or matter. Also, all L or Q cleared employees are subject to random drug testing. Q-level clearance requires U.S. citizenship.
Pre-Employment Drug Test
External applicant(s) selected for this position must pass a post-offer, pre-employment drug test. This includes testing for use of marijuana as Federal Law applies to us as a Federal Contractor.
Equal Employment Opportunity
We are an equal opportunity employer that is committed to providing all with a work environment free of discrimination and harassment. All qualified applicants will receive consideration for employment without regard to race, color, religion, marital status, national origin, ancestry, sex, sexual orientation, gender identity, disability, medical condition, pregnancy, protected veteran status, age, citizenship, or any other characteristic protected by applicable laws.
We invite you to review the Equal Employment Opportunity posters which include EEO is the Law and Pay Transparency Nondiscrimination Provision.
Reasonable Accommodation
Our goal is to create an accessible and inclusive experience for all candidates applying and interviewing at the Laboratory. If you need a reasonable accommodation during the application or the recruiting process, please use our online form to submit a request.
California Privacy Notice
The California Consumer Privacy Act (CCPA) grants privacy rights to all California residents. The law also entitles job applicants, employees, and non-employee workers to be notified of what personal information LLNL collects and for what purpose. The Employee Privacy Notice can be accessed here."
21,DIAGs Software Developer,NOKIA,"Murray Hill, NJ",Onsite,N,r - Full-time,"Come create the technology that helps the world act together
Nokia is committed to innovation and technology leadership across mobile, fixed and cloud networks. Your career here will have a positive impact on people’s lives and will help us build the capabilities needed for a more productive, sustainable, and inclusive world.
We challenge ourselves to create an inclusive way of working where we are open to new ideas, empowered to take risks and fearless to bring our authentic selves to work.

The team you’ll be part of
The pandemic has highlighted how important telecoms networks are to society. Nokia’s Network Infrastructure group is at the heart of a revolution to bring more and faster network capacity to people worldwide through our ambition, innovation, and technical expertise.

As a developer on the “DIAGs” team in our IP/Optical Networks R&D organization, you will develop software and tools to support H/W and S/W development as well as production testing. The team is responsible for and oversees the “Bring-up” and “Diagnostics” software. Bring-up software is used by H/W designers in the early development cycle (prototype stage) to accelerate the delivery of good working H/W boards to the S/W development team. The team’s work will include the development and integration of low-level device drivers, own the developed utilities, and integrate 3rd party Application Peripheral Interfaces (APIs) into a scripting environment in close collaboration with the S/W team to ensure maximum code re-use. Diags are a key component of the production E2E (end-to-end) test strategy.

What you will learn and contribute to
As a DIAGs Software Developer, you are an experienced business professional capable of spearheading efforts to Evolve the Bring-up SW towards Diagnostics tools and deliveries.
Design and develop H/W Bring-up software, for the current upcoming advanced designed products and devices designed out of the High-Speed IP/O data program.
Develop regression tests to verify the Diagnostics tools developed are fault-free.
Contribute to the E2E re-use from the H/W Prototype Bring-up development code towards production implementation and diagnostics.
Document and maintain the developed and code reviewed Diags tools.
Your skills and experience
You have:
Bachelor's Degree/College Diploma, within past year or future grad within 6 months in Telecommunication Engineering, or Computer Engineering.
Experience in C/C++.
Deep understanding of writing code on low level direct hardware access using device data sheets for accessing embedded controller and their peripherals, and knowledge of associated low level interface protocols.
Comfortable working with S/W development environment tools and Linux Operating System.
Proficiency with scripting languages like TCL or Python for test sequencing.
Conceptual understanding of TCP/IP and related protocols.
It would be nice if you also had:
Familiarity with S/W version-control tools like GIT.
Ability to read product hardware schematics and performing digital circuit analysis; experienced in analyzing and debugging failure scenarios.
Ability to develop comprehensive code to thoroughly exercise the H/W functionality of an assigned product and the capability and drive to debug product problems.
Solid teamwork skills and a quality mindset.


What we offer
Nokia offers flexible and hybrid working schemes, continuous learning opportunities, well-being programs to support you mentally and physically, opportunities to join and get supported by employee resource groups, mentoring programs and highly diverse teams with an inclusive culture where people thrive and are empowered.

Nokia is committed to inclusion and is an equal opportunity employer
Nokia has received the following recognitions for its commitment to inclusion & equality:
One of the World’s Most Ethical Companies by Ethisphere
Gender-Equality Index by Bloomberg
Workplace Pride Global Benchmark
At Nokia, we act inclusively and respect the uniqueness of people.
Nokia’s employment decisions are made regardless of race, color, national or ethnic origin, religion, gender, sexual orientation, gender identity or expression, age, marital status, disability, protected veteran status or other characteristics protected by law.
We are committed to a culture of inclusion built upon our core value of respect.
Join us and be part of a company where you will feel included and empowered to succeed."
22,Associate Software Engineer,LifeWay Christian Resources,Remote,Onsite,Full-time,Full-time,"Overview:
We are looking for a Associate Software Engineer with full-stack development skills who is motivated and interested in building services and integrations in modern, functional programming paradigms. You will work in a highly collaborative environment with teammates from varying backgrounds and skill sets coming together to solve challenging problems as a team.

Why Lifeway?

This is a place where you can bring your faith and work experience to join in the most important mission in the world: making disciples of Jesus Christ. Whether you’re a creator or storyteller, data guru or problem-solver, or anywhere in between, if you’re passionate about serving the church, we have a place for you. Lifeway has a strong Work from Anywhere (WFA) culture that is deeply focused on our mission and values. While headquartered in Nashville, TN, many of our positions are remote-eligible and have autonomy and flexibility with work hours. We provide equipment and resources to ensure team members have access to a productive and ergonomic workspace. Lifeway hosts all-team meetings several times per year and provides travel for key team gatherings for remote-based team members. Full-time employees are eligible for enrollment in our comprehensive benefits plans including healthcare, vacation and sick time, holiday pay, care days, 401(k) plan, maternity and paternity leave, adoption assistance, mission trip time, and more.

Learn more about our culture at team.lifeway.com/culture-code

This is a remote position in the U.S with occasional travel to Nashville for in-person team gatherings. #LI-Remote

Responsibilities:
Designs and implements the code necessary to solve technical problems (articulated as agile stories) primarily concentrating on frontend ones
Design and code integrations using REST APIs and event driven technologies (ie: Kafka)
Provide test plan, unit test development and maintenance and UAT testing support
Develop and execute plans for system and network implementations, maintenance, enhancements, and configuration changes
Builds and maintains automated tests and CI/CD pipelines for code produced
Troubleshoots and resolves technical problems
Works closely and collaboratively with an agile team and its product owner to help break down business requirements into stories
Evaluates existing software
Qualifications:
Lives out Lifeway’s mission and values, showing deep commitment to Kingdom work
Bachelor's degree in computer science, information technology degree preferred, OR equivalent work and technical training experience
Agile experience (Scrum and/or Kanban)
Knowledge of Java, Kotlin technologies
Experience in using JavaScript or React.js in web application development
Willingness to learn functional programming paradigm
Git, GitHub experience
Exposure to AWS (Amazon Web Services) or other cloud technology experience including AWS Lambdas
Exposure to message-driven or event-driven architecture experience
Strong written and verbal communication skills
Strong analytical, critical-thinking, and problem-solving skills"
23,Back End Software Engineering Apprentice,HP,"Spring, TX 77389",Onsite,Full-time,Full-time,"HP is a leading global provider of IT products, technologies, solutions, and services to consumers and businesses. We leverage our strong financial position to extend our leadership in traditional markets and invest in exciting new technologies such as 3D printing, immersive computing, hyper-mobility, the Internet of all things, and smart machines. Be part of an organization that manages the Supply Chain IT functions in HP. We design and implement solutions primarily on the SAP platform to support the internal HP business worldwide.
This is a hybrid role - you will be required to go into the office.
A typical day
What you’ll learn: Information Technology Infrastructure Library (ITIL) framework. Proficiency in the following tools and technologies: Java, Unix, WebLogic, SAP, ABAP.
The hands-on work you will experience: As a Software Engineering Apprentice at HP, you’ll work as part of a larger team of experienced developers in an interactive, collaborative environment.
You’ll work on backend systems for large-scale applications for users on web and mobile devices
You'll have opportunities to solve real issues by analyzing system integrations and debugging code
You’ll learn the fundamentals of development, design, testing, agile principles, and continuous delivery.
Best of all, you will be a contributing member of your team, putting forward ideas, taking on responsibilities, and making choices about how you get the job done
Education Required
Either a High School Diploma, GED, or Associate Degree
Knowledge and Skills
Teamwork
Communication
Learning
Prior interest in coding; some exposure to web development through personal projects, academics, or professional experience
Able to work independently and take initiative, as well as work collaboratively and contribute to an agile team environment
Understanding of supply chain principles and concepts
Ability to effectively articulate technical challenges and solutions
An interest in Teamwork
Great Communication skills
Learning mentality
Problem Solving skills

About HP

You’re out to reimagine and reinvent what’s possible—in your career as well as the world around you.
So are we. We love taking on tough challenges, disrupting the status quo, and creating what’s next. We’re in search of talented people who are inspired by big challenges, driven to learn and grow, and dedicated to making a meaningful difference.

HP is a technology company that operates in more than 170 countries around the world united in creating technology that makes life better for everyone, everywhere.

Our history: HP’s commitment to diversity, equity and inclusion – it's just who we are.
From the boardroom to factory floor, we create a culture where everyone is respected and where people can be themselves, while being a part of something bigger than themselves. We celebrate the notion that you can belong at HP and bring your authentic self to work each and every day. When you do that, you’re more innovative and that helps grow our bottom line. Come to HP and thrive!"
24,JUNIOR SOFTWARE DEVELOPER,Fundamental Interactions,"New York, NY 10001",Onsite,N,Full-time,"New York City and Boston and suburban area
Flexiable work environment and excellent benefits package
Responsibilities:
As a key member of the software development and delivery team, you will:
Work with other developers and project managers to develop and deliver software products and solution implementations.
Contribute to the evolution and enhancement of both our trading system and blockchain platform.
Participate in solution development/delivery, using our products and platforms.
Leverage Agile practices to incrementally and iteratively deliver.
Work with back-end trading systems and manage middleware applications that connect to primary systems.
Job Requirements :
Proficiency in one or more OO languages (Ruby, Python, JAVA).
Familiarity with distributed systems patterns and techniques (SOA preferred).
Experience with sockets, websockets, and/or message oriented middleware.
Experience with serialization techniques like JSON, binary.
Experience building, troubleshooting, and debugging systems.
Knowledge of cryptocurrencies, and blockchain technologies is helpful.
1-3 years of experience with software solutions.
Closely work with management, development and support teams
Education:
Bachelors or Masters Degree in Computer Science or other relevant engineering field"
