,Title,Company,Location,Type,Salary,Contract_type,Job Description
0,Software Developer,Lawrence Livermore National Laboratory,"Livermore, CA 94550",Onsite,"$103,290 - $139,128 ",r - Full-time,"Company Description
Join us and make YOUR mark on the World!
Are you interested in joining some of the brightest talent in the world to strengthen the United States’ security? Come join Lawrence Livermore National Laboratory (LLNL) where our employees apply their expertise to create solutions for BIG ideas that make our world a better place.
We are committed to a diverse and equitable workforce with an inclusive culture that values and celebrates the diversity of our people, talents, ideas, experiences, and perspectives. This is essential to innovation and creativity for continued success of the Laboratory’s mission.
Pay Range
$103,290.00 - $139,128.00 Annually for the SES.1 level and $123,960.00 - $166,992.00 Annually for the SES.2 level

Please note that the pay range information is a general guideline only. Many factors are taken into consideration when setting starting pay including education, experience, the external labor market, and internal equity.
Job Description
We have multiple openings for Software Developers with a combination of education and experience commensurate with supporting a variety of software development assignments. The selected candidates will work on multi-disciplinary teams in an environment that encourages the support of the academic research community while focusing on problems of interest to LLNL and DOE programs as a member of a dynamic, multidisciplinary team environment. These positions will be within a group in the Computing Directorate.
This position will be filled at either level based on knowledge and related experience as assessed by the hiring team. Additional job responsibilities (outlined below) will be assigned if hired at the higher level.
In this role you will
Provide computer science and software development support using industry standard software development practices and modern programming languages and operating systems.
Develop a range of applications including scientific, graphical user interface, database, and visualization applications on UNIX platforms.
Participate in the requirements definition, analysis, design, implementation, debugging, testing, and optimization of computer programs on workstations.
Participate on a research team to support work and research papers.
Contribute to the fulfillment of technical projects and organizational objectives, functioning as an effective team member on multi-disciplinary teams.
Engage other developers frequently to share relevant knowledge, opinions, and recommendations.
Perform other duties as assigned.
Additional job responsibilities, at the SES.2 level
Design, implement, deploy, and maintain software systems using object-oriented analysis, design, and programming techniques.
Provide solutions to moderately complex problems involving largely identifiable factors.
Qualifications
Bachelor’s degree in computer science, computer engineering, or a related field, or the equivalent combination of education and related experience.
Skilled in all aspects of software project life cycle: feasibility, requirements, design, implementation, integration, test and deployment.
Experience developing software with either Python, C++ or JAVA within Linux, UNIX, and/or Windows environments.
Ability to effectively manage concurrent technical tasks with competing priorities and meet deadlines that are important to project success.
Experience approaching difficult problems with enthusiasm and creativity.
Effective interpersonal skills necessary to interact with all levels of personnel with the ability to work independently in a multi-disciplinary team environment.
Effective written and verbal communication skills to prepare, present, and document technical information.
Additional qualifications at the SES.2 level
Ability to work effectively with minimal guidance.
Experience providing innovative approaches and applying new technologies to broadly defined tasks and projects.
Broad experience applying effective analytical and problem-solving skills to moderately complex problems.
Qualifications We Desire
Master’s Degree in Computer Science or related field.
Experience with Perl, Web Technologies, Ajax, or HTML5, Oracle database schema design and SQL, distributed control systems, real-time operating systems, Big Data analytics, NAS, platforms, resource management systems, Linux virtualization, cloud computing technologies, grid frame works, and cloud file systems, revision control systems, remote boot protocols, and/or experience in a High Performance Computing environment.
Experience with application development using object oriented methods, an understanding of fundamental networking and distributed computing concepts, and/or experience maintaining a High Performance Computing system.
Additional Information
All your information will be kept confidential according to EEO guidelines.
Position Information
This is a Career Indefinite or At Will appointment. Lab employees and external candidates may be considered for this position.
Why Lawrence Livermore National Laboratory?
Flexible Benefits Package
401(k)
Relocation Assistance
Education Reimbursement Program
Flexible schedules (*depending on project needs)
Inclusion, Diversity, Equity and Accountability (IDEA) - visit https://www.llnl.gov/diversity
Our core beliefs - visit https://www.llnl.gov/diversity/our-values
Employee engagement - visit https://www.llnl.gov/diversity/employee-engagement
Security Clearance
This position requires a Department of Energy (DOE) Q-level clearance. If you are selected, we will initiate a Federal background investigation to determine if you meet eligibility requirements for access to classified information or matter. Also, all L or Q cleared employees are subject to random drug testing. Q-level clearance requires U.S. citizenship.
Pre-Employment Drug Test
External applicant(s) selected for this position must pass a post-offer, pre-employment drug test. This includes testing for use of marijuana as Federal Law applies to us as a Federal Contractor.
Equal Employment Opportunity
We are an equal opportunity employer that is committed to providing all with a work environment free of discrimination and harassment. All qualified applicants will receive consideration for employment without regard to race, color, religion, marital status, national origin, ancestry, sex, sexual orientation, gender identity, disability, medical condition, pregnancy, protected veteran status, age, citizenship, or any other characteristic protected by applicable laws.
We invite you to review the Equal Employment Opportunity posters which include EEO is the Law and Pay Transparency Nondiscrimination Provision.
Reasonable Accommodation
Our goal is to create an accessible and inclusive experience for all candidates applying and interviewing at the Laboratory. If you need a reasonable accommodation during the application or the recruiting process, please use our online form to submit a request.
California Privacy Notice
The California Consumer Privacy Act (CCPA) grants privacy rights to all California residents. The law also entitles job applicants, employees, and non-employee workers to be notified of what personal information LLNL collects and for what purpose. The Employee Privacy Notice can be accessed here."
1,Software Engineer Apprentice,IBM,"San Jose, CA 95101",Onsite,"$93,120 - $102,432 ",r - Full-time,"Introduction
At IBM, work is more than a job - it's a calling: To build. To design. To code. To consult. To think along with clients and sell. To make markets. To invent. To collaborate. Not just to do something better, but to attempt things you've never thought possible. Are you ready to lead in this new era of technology and solve some of the world's most challenging problems? If so, lets talk.

Your Role and Responsibilities
Are you interested in pursuing a software development career? Have you heard about agile development, but want to learn more about how it ‘works’? Are you someone that has a foundational understanding of development or programming concepts, but want to take a less traditional path to achieve it?

What is an Apprenticeship?
IBM Apprenticeship Program, which lasts approximately 12 months, is an official registered apprenticeship recognized by the Department of Labor (DOL). Every graduate of a Registered Apprenticeship program receives a nationally-recognized credential from the DOL.

During the apprenticeship duration, you will be required to complete specific learning hours and on the job training that has been outlined to ensure you are developing the skills and competencies essential to the role. You will be able to learn and grow at your own pace, but we expect most apprentices will complete their learning within 12 months. Once you graduate and receive your certificate from our apprentice program, you will be eligible to apply to available full-time roles at IBM.

Who You Are
An apprenticeship is about learning. We’re seeking candidates who have the following requirements, but we know you’re just getting your career started, and we’re committed to helping you learn and grow. If you’ve had some experience with coding or development in the past, you’re exactly the type of candidate we’re looking for….
Drive and eagerness to learn
Strong problem solving and communication skills
Able to work independently and take initiative, as well as work collaboratively and contribute to an agile team environment
Some knowledge or experience in ONE or more of the following:
Java, JavaScript, PHP, C#, Objective-C, C/C++, Python, Ruby and/or functional languages (Haskell, Scala, F#, Clojure)
Design Thinking
Hypothesis driven development
Social coding
Agile principles
Container development using tools such as Docker or Vagrant
Application Development, DevOps automation, and the development toolchain (e.g. Travis, Jenkins, Junit, automated test tools)
What’s the Experience?
As an apprentice, you'll join with other apprentices in a local cohort. You'll go through your first few weeks together, learning about IBM and the skills you'll be attaining throughout your apprenticeship. Then, you'll work with your managers and mentors to progress through your personal skills roadmap, learning and demonstrating new knowledge and competencies through hands-on application with your project teams. You'll complete milestones along the way, earning digital credentials to validate your skills, and will come back together with other apprentices to participate in on-going training and development focused on your professional and technical skills.

As a Software Engineer Apprentice at IBM, you’ll work as part of a larger team of experienced developers and mentors in an interactive, collaborative environment. You’ll learn the fundamentals of development, software design, testing, and cloud computing, agile principles, IBM Design Thinking, DevOps and continuous delivery. You will also learn how to resolve IBM customer issues, debug customer problems and environments, and increase Cloud Service skills, and will build the skills to grow your career as a Software Developer. Best of all, you are a contributing member of your team, putting forward ideas, taking on responsibilities and making choices about how you get the job done just like any other IBMer.

The work location for this position is San Jose, CA. Must be local or willing to relocate at own expense. No relocation is available for this position.

Required Technical and Professional Expertise
Must have basic knowledge in one of the following programming languages: Java, JavaScript, PHP, C#, Objective-C, C/C++, Python, Ruby and/or functional languages (Haskell, Scala, F#, Clojure)
Willingness to complete the requirements of the apprenticeship program.

Preferred Technical and Professional Expertise
none

About Business Unit
IBM’s Cloud and Cognitive software business is committed to bringing the power of IBM’s Cloud and Watson/AI technologies to life for our clients and ecosystem partners around the world. IBM provides you with the most comprehensive and consistent approach to development, security and operations across hybrid environments—with complete software solutions for business and IT operations, development, data science, security, and management. Our experts and software capabilities help organizations develop applications once and deploy them anywhere, integrate security across the breadth of their IT estate, and automate operations with management visibility. With IBM, you also have access to new skills and methods, governance and management approaches, and a deep ecosystem of industry experts and partners.
This job requires you to provide your COVID-19 vaccination status with supporting documentation, where legally permissible.

Your Life @ IBM
In a world where technology never stands still, we understand that, dedication to our clients success, innovation that matters, and trust and personal responsibility in all our relationships, lives in what we do as IBMers as we strive to be the catalyst that makes the world work better.
Being an IBMer means you’ll be able to learn and develop yourself and your career, you’ll be encouraged to be courageous and experiment everyday, all whilst having continuous trust and support in an environment where everyone can thrive whatever their personal or professional background.
Our IBMers are growth minded, always staying curious, open to feedback and learning new information and skills to constantly transform themselves and our company. They are trusted to provide on-going feedback to help other IBMers grow, as well as collaborate with colleagues keeping in mind a team focused approach to include different perspectives to drive exceptional outcomes for our customers. The courage our IBMers have to make critical decisions everyday is essential to IBM becoming the catalyst for progress, always embracing challenges with resources they have to hand, a can-do attitude and always striving for an outcome focused approach within everything that they do.
Are you ready to be an IBMer?

About IBM
IBM’s greatest invention is the IBMer. We believe that through the application of intelligence, reason and science, we can improve business, society and the human condition, bringing the power of an open hybrid cloud and AI strategy to life for our clients and partners around the world.

Restlessly reinventing since 1911, we are not only one of the largest corporate organizations in the world, we’re also one of the biggest technology and consulting employers, with many of the Fortune 50 companies relying on the IBM Cloud to run their business.

At IBM, we pride ourselves on being an early adopter of artificial intelligence, quantum computing and blockchain. Now it’s time for you to join us on our journey to being a responsible technology innovator and a force for good in the world.

Location Statement
IBM offers a competitive benefits program which may include medical & prescription drug coverage, dental, vision, mental health & well being, 8 paid holidays, minimum 56 hours paid sick time, 80 hours paid vacation, life insurance, 401(k), financial counseling, and the IBM Employee Stock Purchase Plan. IBM offers paid family medical leave and disability benefits to eligible employees where required by applicable law.

The compensation range and benefits for this position are based on a full-time schedule for a full calendar year. The salary will vary depending on your job-related skills, experience and location. Pay increment and frequency of pay will be in accordance with employment classification and applicable laws. For part time roles, your compensation and benefits will be adjusted to reflect your hours. Benefits may be pro-rated for those who start working during the calendar year.

IBM will not be providing visa sponsorship for this position now or in the future. Therefore, in order to be considered for this position, you must have the ability to work without a need for current or future visa sponsorship.

We consider qualified applicants with criminal histories, consistent with applicable law.

Being You @ IBM
IBM is committed to creating a diverse environment and is proud to be an equal opportunity employer. All qualified applicants will receive consideration for employment without regard to race, color, religion, gender, gender identity or expression, sexual orientation, national origin, genetics, pregnancy, disability, age, veteran status, or other characteristics. IBM is also committed to compliance with all fair employment practices regarding citizenship and immigration status."
2,SOFTWARE DEVELOPER,Capgemini,"Denver, CO",Onsite,Contr,ct,"Duration: 9+ months

Job Description:

Candidate must have the following skills:
Hands on experience with Cisco Network Service Orchestrator (NSO). Development of service packages, deployment of NSO.
Working experience of Agile Software Development methodology

The candidate should have prior experience (about 3-8 years) of delivering on complex and highly scalable software projects.

The candidate should have strong verbal and written communication skills, with the ability to work effectively across internal and external organizations. The person should be self-motivated and able to work independently and/or in support of small teams

Desired Skills
The person should have skillsets on most of these software technologies:
Hands-on experience with programming languages like Java, Python, JavaScript, No-SQL & Relational Databases
Expertise with XML, JSON, XSLT, RESTful API
Hands on experience with SDLC tools (Jenkins, Git, Automated Testing Frameworks)
Working knowledge of MEAN stack (Mongo, Express, Angular & Node.JS) is preferred
Working knowledge of BPMN workflow engines (jBPM/Activiti or Camunda etc) is preferred
Hands on experience with software integration - Web Services (SOAP/RESTful), ESB
Working knowledge of network & software configuration tools such as Ansible, Chef/Puppet/ Cisco BPA.
Knowledge of Virtualization & Cloud (VMware, OpenStack)
Knowledge of Analytics with Big Data, AI, Machine Learning algorithms
Exposure to networking architectures including DC, WAN, Campus, Mobility, Security is a plus

The Capgemini Freelancer Gateway is enabled by a cutting-edge software platform that leads the contingent labor world for technology innovation. The software platform leverages Machine Learning and Artificial Intelligence to make sure the right people end up in the right job.

A global leader in consulting, technology services and digital transformation, Capgemini is at the forefront of innovation to address the entire breadth of clients’ opportunities in the evolving world of cloud, digital and platforms. Building on its strong 50 year heritage and deep industry-specific expertise, Capgemini enables organizations to realize their business ambitions through an array of services from strategy to operations. Capgemini is driven by the conviction that the business value of technology comes from and through people. It is a multicultural company of over 200,000 team members in more than 40 countries. The Group reported 2018 global revenues of EUR 13.2 billion."
