,Title,Company,Location,Type,Salary,Contract_type,Job Description
34,High Voltage Cable Engineer,offshore-staffing.com,"Huntersville, NC",Onsite,"$61,000 - $85,000 ",r - Full-time,"Must-Haves:
Bachelor's degree in Electrical or Mechanical Engineering
4+ years' experience working with ICEA, AEIC, IEC and IEEE standards
4+ years' experience working with Cymcap, SolidWorks, AutoCAD, Matlab and Microsoft Office Suite
Understanding of electrical and mechanical engineering disciplines to analyze and resolve problems.
Would need to relocate to Huntersville, NC or be willing to travel frequently.

Nice-To-Haves:
Working knowledge of underground power transmission engineering discipline
A strong team player
Analytical and problem-solving skills

Job Description:
Southwire designs, manufactures, markets, and implements High Voltage Underground cables and Systems in North America. Southwire’s strategy is to aggressively grow its sales volume in HV underground cables, accessories, and installation as well as its cable systems-related portfolio of ancillary products and services. The High Voltage Cable team places high value on supporting the renewable energy market segment.
This High Voltage Cable Design Engineering position encompasses the design and analysis of parts, components, assemblies, and subassemblies of underground HV/EHV transmission cable systems, and the production of associated drawings and instructions.
Under limited direction, this individual will perform a variety of complex engineering assignments requiring in-depth knowledge of electrical engineering plus an understanding of related high-voltage equipment and engineering aspects to cost-effectively achieve objectives. The individual will proactively seek and implement initiatives to improve operations and increase customer satisfaction.
Description of Duties and Responsibilities:
Design complete cable system solutions, including accessories, link boxes, fiber optic components, grounding details and bonding schemes for voltage classes 69kV up to 500kV, using advanced computer programs, analytical techniques or control strategies to effectively meet project/bid requirements.
Review customer specifications to determine feasibility and compliance.
Conduct the preparation of specifications, proposals for contracts, licensing and safety documents, and obtain required approvals in cooperation with the Sales & Marketing and Project Management teams.
Support manufacturing throughout the production cycle. This includes creating testing plans, leading design handover meetings and solving problems on the manufacturing floor.
Execute Research & Development projects including planning, timeline forecast, budget management and logistics coordination using the “Stage Gate” process.
Represent the group in meetings and conferences; interact with customers to provide training seminars as well as resolve significant technical issues and develop related action plans.
Make formal technical presentations to customers and to industry forums and at conferences.
Promote safety in the workplace and all project sites following Southwire’s Culture of ZERO.

Qualifications and Experience Requirements:
Bachelor's degree in electrical or mechanical engineering plus 3 years of experience, or a special combination of education and experience and/or demonstrated accomplishments.
Understanding of electrical and mechanical engineering disciplines to analyze and resolve problems. Working knowledge of underground power transmission engineering discipline is a plus.
Familiarity with ICEA, AEIC, IEC and IEEE standards, as well as thermal, mechanical and electrical field calculations
Ability to read and analyze engineering drawings.
Strong technical writing ability and solid communication skills. Requires the ability to interface effectively both internally and with customers.
Experience with software packages including Cymcap, SolidWorks, AutoCAD, Matlab and Microsoft Office Suite.
Proficiency in visual basic and similar programming languages, primarily for use in coding spreadsheets and macros within Microsoft Excel.

Interview Steps:
Phone interview
Panel interview
Final interview



About offshore-staffing.com:

Offshore Staffing is the leading agency that provides consulting and recruitment solutions. Our staffing solutions cover technical, professional, and industrial recruiting and staffing. We staff a wide range of industries including aviation, engineering, architecture, construction,energy, aerospace & defense, administrative, and a lot more to serve the need for customized recruitment and placement solutions for large and small business. Offshore Staffing operates in the USA, Canada, Brazil, Europe and Asia.Mission: Offshore seeks to simplify staffing processes and procedures by applying an intuitive combination of technology and human skills. Our experience has taught us that technology only goes so far when aligning a candidate and his or her skills with a client’s business. To integrate personnel into a company’s culture, Offshore relies on a proprietary matrix that gauges in-depth interviews, personality assessments, work qualifications and background screens."
35,Construction Inspector Specialist - Construction Inspector IV,City of Tampa,"Tampa, FL",Onsite,"$64,085 - $115,606 ",r - Full-time,"Nature Of Work
Employees in this class are responsible for performing highly technical inspections of residential and commercial structures and construction sites to ensure conformance with approved plans and state/municipal codes, regulations, and ordinances.
Employees in the class work under the license of the Building Official for a one (1) year period while training and preparing to obtain a minimum of one (1) of five (5) state inspector licenses. Tasks are of more than average difficulty, requiring employees to possess considerable knowledge and expertise in: building construction and related site work; plumbing, electrical and mechanical installations; inspection procedures; and associated codes. Work involves the inspection of residential and commercial buildings which are under construction or being repaired, remodeled or enlarged and is performed during various stages of completion to ensure structural integrity and compliance with building codes and ordinances. An important aspect of this work is prevention of pollution or contamination of water and sewer facilities in order to protect the health of the community being served by these facilities.
Employees must exercise extreme caution in performing mechanical inspections because work is conducted in proximity to equipment operating at hazardous high pressures, temperatures, and voltages. Reasonable initiative and independent judgment are required in determining whether changes are needed in plans and in making recommendations to contractors, engineers, architects, etc. Accurate, complete, and current inspection records are maintained to provide supporting documentation, particularly when approval is not given, a violation is determined to exist, or a project plan must be modified. An employee must exercise tact and courtesy when conducting inspections, in the resolution of inspection problems, and in the explanation of code content or its interpretation to the general public, contractors, engineers, builders, and owners. Employees operate lightweight motor vehicles to travel among work locations and perform tasks requiring moderate exertion, including climbing ladders, scaffolds, etc. Work is performed under general supervision and reviewed through observation, conferences, and inspection reports submitted.
Examples of Duties
Based on Licensure Type, inspectors perform required inspections of foundations, concrete slabs, beams, pilasters, steel placement, framing, insulation, roofing, and related construction work; performs inspections of mechanical, electrical, plumbing, gas and solar energy equipment and systems as well as site construction (zoning, tree/landscaping, transportation and stormwater features); determines safety of installation, adequacy of capacity, durability of materials, and compliance with code; orders a cease in operations if installations or operations do not conform to applicable codes or if proper licenses and permits are not obtained; conducts final inspection for Florida Residential Code and Land Use Code Compliance prior to issuance of Certificate of Occupancy or completions.
Conducts inspections to ascertain compliance with flood control ordinances; inspects the placement, height, foundation, set back.

Evaluates type, condition, life expectancy of trees and conflict with utilities and structures for possible removal or corrective action; inspects construction sites for tree protection, evaluates proper root pruning; interprets plans and inspects site for quality and quantity of planted materials for residential and commercial construction projects; performs periodic unscheduled tree barricade inspections.

Conducts compliance inspections for driveway aprons, curbing, sidewalks; evaluates right-of-way for sight obstruction hazards; ensures barricades and safety signage are properly located.

Inspects on-site culverts, control structures, headwalls, pipe tie-ins, mitered end sections, retention ponds, infiltration systems, vaults, installation of underground stormwater pipe, inlets, and manholes for commercial and residential construction projects; safeguards Environmental Protection Code (EPC) protected wetlands by assuring installation and maintenance of silt barriers along jurisdictional wetland lines; ensures correct size and location, spacing, and placement of wall forms.

Investigates complaints regarding code and permit violations and faulty work; determines if a violation or hazard exists; notifies owners or contractor that corrective action must be taken; issues citations and presents complaint cases to judicial boards as necessary; ensures completion of corrective action.

Researches and organizes files; extracts data from reports; maintains inspection records; prepares inspection reports as well as completes time sheets; performs mathematical calculations for work projects.
Reads and interprets plans and specifications to facilitate proper construction methods, etc.; examines construction documents to determine conformity with applicable building and related regulations; contacts developers to obtain required documentation.

Identifies hazardous conditions or accident potential to facilitate prevention and/or correction; conducts equipment inspections for adherence to safety standards; checks all emergency repairs and decides what action should be taken; performs damage assessment and habitability inspections of both commercial and residential buildings as part of the City’s emergency response and recovery responsibilities.

Interprets codes and regulations for, consults with, and advises engineers, architects, contractors, builders, owners, and other concerned parties, both orally and in writing.

Interprets and summarizes regulatory agency requirements and recommends appropriate action; keeps others abreast of changes to content and interpretation of codes for proper enforcement; participates in meetings, public workshops, and seminars to gather, present, and distribute information.

Evaluates various water and gas meters and notifies companies of malfunctions and necessary repairs. Coordinates work with Wastewater and Water Departments to ensure proper connection to city facilities; coordinates installation of wells and septic tanks with Southwest Florida Water Management District and Hillsborough County Health Department.

Operates and maintains portable computer/printer and photographic equipment as part of mobile data system; inputs permit, plans and inspection data, utilizes email and internet programs, and utilizes word processing, mapping and other application software.

Performs related work as required.
Knowledge, Skills & Abilities
Considerable knowledge of: principles and practices of building design and construction; landscaping, transportation and stormwater methods, practices, and materials; building and site codes, standards and ordinances; building and inspection procedures, practices, and methods.

Working knowledge of: the layout of the City and its geography; computer equipment and software.

Ability to: read, interpret, and work from construction plans, blueprints, and schematics; enforce applicable codes and ordinances with firmness, impartiality, and tact; follow oral and written instructions; prepare and submit clear and concise written reports; perform work requiring moderate physical exertion, including climbing ladders; operate a lightweight motor vehicle; establish and maintain effective working relationships with other employees, the construction industry, utilities and the general public.

Skill in: the use and maintenance of building and site construction testing equipment, electronics including cell phones, laptops and computers.
Minimum Qualifications
Graduation from an accredited high school or vocational school and pursuant to Florida Statue Section 468.609, four (4) years of experience in building and site construction practices.

Additional requirements for higher levels:

Inspector I - IV: Preferred qualifications include two (2) years college level course work in construction, engineering, architecture or related field.

Construction Inspector II, III and IV : one (1) year of experience in application of municipal and state codes, laws, rules and regulations.
Licenses or Certifications
All Levels
a valid Florida driver’s license
Inspector Specialist: Must obtain one (1) Florida Standard Inspector License (Building, Mechanical, Electrical, Plumbing or One & Two Family Dwelling – FS 468) within one (1) year of employment. Site Inspectors must obtain the Florida Floodplain Managers Certification within one (1) year of employment.

Inspector I: Must possess one (1) Florida Standard Inspector Licenses (Building, Mechanical, Electrical, Plumbing or One & Two Family Dwelling – FS 468)

Inspector II: Must possess two (2) Florida Standard Inspector Licenses (Building, Mechanical, Electrical, Plumbing or One & Two Family Dwelling – FS 468)

Inspector III: Must possess three (3) Florida Standard Inspector Licenses (Building, Mechanical, Electrical, Plumbing or One & Two Family Dwelling – FS 468)

Inspector IV: Must possess four (4) Florida Standard Inspector Licenses (Building, Mechanical, Electrical, Plumbing or One & Two Family Dwelling – FS 468).

Note: Applicants selected for employment must place their Contractor’s License on inactive status with the State immediately upon employment.
Examination
Evaluation of education and experience. Drug testing is included in all pre-employment processing.
Comments
Employees may be required to work rotating shifts, including nights, weekends, holidays and overtime as needed. During periods when the Mayor issues an emergency declaration for the City of Tampa, all employees may be required to work in preparation, response or recovery activities related to the stated emergency."
36,Medical Safety Engineer,Intertek,"70 Codman Hill Rd, Boxborough, MA 01719",Onsite,Full-time,Full-time,"Medical Safety Engineer
Intertek, a leading provider of ATIC (Assurance, Testing, Inspection, and Certification) Services, is looking for a Medical Safety Engineer to join our Electrical team in Boxborough, MA. This is a fantastic opportunity to grow a versatile career in facilitating international trade and regulatory product testing. By joining Intertek, your contributions will be valued as we continue to help the world Build Back Ever Better .
Our dedicated professionals help ensure the quality, safety, and sustainability of electrical products used by people throughout the world. The Intertek office in Boxborough, MA works primarily in the Electrical Safety, Performance, and EMC business lines. This position is to join our 14-person Medical Electrical Safety team, where you'll work directly with medical device manufacturers across the globe in evaluating their products against published safety standards.
The ideal candidate will have a bachelor’s degree in engineering, preferably Electrical Engineering or Biomedical Engineering. The ideal Medical Safety Engineer will also be engaging, have good interpersonal skills, high energy, high sense of urgency, and adept at wearing many hats in one day.
What will you be doing?
The Medical Safety Engineer is responsible for performing electrical testing and evaluation on a variety of products to the provisions of U.S., Canadian and other international product safety standards; writing reports; and communicating with clients. Under the guidance of a more senior Engineer, may also conduct on and off-site evaluation of products to determine compliance with applicable standard(s).
Duties:
Read and determine applicability of national/international codes and standards for the product being tested and/or evaluated.
Read and understand schematics and manufacturing instructions.
Validate the project scope and sample applicability.
Complete preliminary design reviews (PDR) both on and off site.
Conduct thorough construction review of device design aspects against standard compliance criteria.
Develop, set up, and follow established test plans.
Set up and operate standard test equipment including, but not limited to: spectrum analyzer, oscilloscope, multi-meter, dielectric strength tester, ground continuity tester, digital multi-meter, surge generator, over-voltage tester, environmental condition chambers, articulated probes.
Perform testing of products in accordance with standards. Core tests include, but are not limited to: rating, leakage current, dielectric, temperature, pressure, stability, mechanical hazard, flammability, etc.
Will develop expertise in IEC 60601.
Compile test results, analyze data, and product description information into report templates and shells. Submit report to reviewer for final approval.
Communicate project status and test results to client, sales personnel, and management throughout testing.
Provide on-going support to clients and Intertek sales representatives as needed.
Perform other work as required.
This position outline is a general guideline and does not represent all encompassing details.
Qualifications :
Bachelor's degree in engineering (Electrical or Biomedical Engineering preferred)
Experience with U.S., Canadian, and other international product safety standards preferred.
Must be detailed-oriented and able to effectively prioritize and organize workload, with efficient time management.
Ability to define problems, collect data, establish facts and draw valid conclusions.
Ability to make technical decisions and engineering judgments independently within established parameters.
Ability to communicate and interact effectively in both verbal and written format.
Microsoft Office expertise.
Excellent customer service skills.
Must be self-motivated and able to work independently in a fast-paced, multi-tasking environment.
Project management experience is a plus.
Ability to travel up to 15% as business needs dictate.
A valid driver's license and reliable driving record is required.
Why Work at Intertek?
Intertek is a world leader in the $250 billion Quality Assurance market, with a proven, high-quality business model and a global network of customer-focused operations and highly engaged subject matter experts. At Intertek, we exercise our spirit of innovation, the passion of our people and our unmatched customer commitment to realize our purpose of making the world an ever better, safer, and more sustainable place for all. Learn more about Our History and What We Do .
Intertek is committed to a safe work environment for our employees and clients. Learn more about our COVID-19 Policy .
What we have to offer
When working with Intertek, you can expect salary and benefit package competitively placed within the local market, including:
Competitive benefits package; Medical, Dental, Vision, Life, and Disability
401(k) with company matching
Competitive market pay
Generous vacation/sick time (PTO)
Tuition reimbursement and much more.
Intertek is a drug-free workplace. As a condition of employment, all hires are required to pass a pre-employment drug test.
Intertek believes that Our People are our strongest tool for success. We are an Equal Opportunity Employer and do not discriminate against applicants due to veteran status or on the basis of disability. All qualified applicants will receive consideration for employment without regard to race, color, religion, sex, national origin, sexual orientation, or gender identity.
For individuals with disabilities who would like to request an accommodation, or who need assistance applying, please email hr.eeoc.data@intertek.com or call 1-877-694-8543 (option #5) to speak with a member of the HR Department.
#LI-AR1
CA-AR"
