,Title,Company,Location,Type,Salary,Contract_type,Job Description
22,Engineer 3,Aquawolf,"Denver, CO 80249",Onsite,N, week,"Position Summary
This is a professional position responsible for the layout, planning, directing, training, coordinating civil/structural analysis, and design of distribution lines and/or high voltage electrical transmission lines. Assignments will include the completion of: calculations, construction drawings, contracts, technical specifications, design standards, as well as the application of those designs for the construction of distribution and/or transmission lines. The successful candidate will possess a broad and deep understanding of engineering principles and practices, and the ability to apply that knowledge and experience to most aspects of project scope, schedule, budget, construction, and overall project completion.
Qualifications
Essential Functions & Responsibilities
Perform civil/structural engineering analyses and design for distribution/transmission line layout and design through 500kV
Prepares a variety of complex engineering deliverables
Conduct/coordinate and/or assist in design review meeting for projects or as assigned
Create and support construction contracts, material take-offs, material standards, and technical specifications
Create/develop drawing packages for bidding, construction, as-built, and submittal purposes
Performs complex research and develops recommendations for equipment and/or material selection
Coordinate construction activities with technical support and timely review of submittals
Self-motivated capable of working independently or in a team toward the timely completion of assigned projects
Effective verbal and written communication including technical writing skills
Effectively communicate project scopes, budgets, and schedules
Assist in the preparation of budgets for projects
Develops training modules and initiatives at the directive of the Principal Engineer
Attain knowledge and remain knowledgeable of development in regulations, laws, standards, and best practices applicable to our functional area, including but not limited to, Standards of Conduct, NERC Reliability, and the National Electric Safety Code
Provide technical direction to others, as required
Aide in the direction of work for others, as required
Serve as contact with construction field crews and project management on moderately complex projects
Provides support to business development or pursuit activities
Other Responsibilities & Duties
Perform other related duties as assigned
Job Competencies & Success Factors
Strong interpersonal and communication skills
Strong team player: Accomplish tasks by working with others and recognizing how his/her decisions may impact the team and have a willingness to seek input from others
Quality: Accomplish tasks with a high level of quality so rework and corrections are minimal or nonexistent
Time Management: Have the ability to successfully plan and accomplish tasks within an established timeline
Computer proficiency in operating a personal computer and standard business office applications including Microsoft Office, AutoCAD, PLS-CADD, SAG-10, LPile, MFAD, and other related applications
Ability to analyze problems and develop effective solutions at both strategic and functional levels
Work independently with minimal direction as a highly motivated self-starter
Required Job Qualifications
Education & Training:
Bachelors degree in Civil or Structural Engineering or other similarly related engineering disciplines
Registered as a Professional Engineer in Colorado or California.
Knowledge, Skills, Ability:
Basic knowledge of civil/structural transmission line design
Working knowledge of PLS-CADD, PLS-Pole, MFAD
Academic knowledge of civil engineering principles and practices, including computer applications
Academic knowledge of field techniques for construction of transmission lines
Academic knowledge of surveying techniques, practices, and procedures
Basic knowledge of safe working practices related to electric transmission lines
A desire to work in the areas of distribution design and transmission line design
Experience:
Four (4) to eight (8) years of experience in Civil/Structural engineering, preferably related to electric transmission line design.
Other:
Willingness to travel up to 25% of the time on an annual basis.
Must possess a valid drivers license.
Must be able to demonstrate the ability to perform all of the essential functions of this position.
Desired Job Qualifications
A desire to learn Project Management techniques and/or Construction methods
Experience in other industries related to Civil/Structural Engineering
Interest in or member of an industry organization (ASCE, IEEE, NESC, etc.)
Salary Range
$83,000-$112,000 annually"
23,"Senior Engineer I, High Voltage Systems - 1295549",Impact Solutions,"Dublin, CA",Onsite,N, week,"We are the largest and most dependable manufacturer of Heavy-Duty Transit Buses in North America. Our customers are in all 50 states, and include cities, counties, transit districts, universities and major private fleet operators. We are headquartered in Livermore, CA. We offer an excellent compensation and benefits package including 100% company-paid premiums for medical, dental and vision for employees and their families. Other benefits include a unique 401k profit-sharing plan and pension.
JOB SUMMARY
The Senior Engineer I in the New Product Engineering team will be responsible for the design, development, and integration of the High Voltage systems for all new vehicles. This candidate will be the owner of the High Voltage systems specifications and drive them back to the suppliers to meet and exceed every aspect of requirements. You will have direct influence on vehicle electrical systems from concept through to manufacturing launch to field support.
You will be part of the team that develops the industry’s best-in-class zero emission bus. This role will focus on High Voltage (HV) design requirements and component evaluation and selection for the application, including HV cable assemblies, HV connectors, and HV circuit protection devices. Assignments are broad in scope and highly complex that require outstanding creativity, superior initiative, good judgement, and leadership skills combined with the willingness to do hands-on engineering. You will report directly to the Electrical Engineering Manager in New Product Engineering.
TECHNICAL FOCUS
DC Charging
High Voltage systems
KEY RESPONSIBILITIES
Develop and maintain the requirements and standards for the High Voltage designs.This includes staying up to date with the latest SAE charging standards as it pertains to heavy-duty electric vehicles
Be the HV subject matter expert with cross-functional teams and suppliers
Evaluate and select HV component for new vehicles that meet design specifiications and work with cross-functional teams to drive new high voltage designs through design phase into production
Perform design analysis on electrical loads, power distribution, & circuit protection
Review, analyze, and approve EMC test results
Lead DFMEA discussions in order to identify potential risks and implement design changes to mitigate potential failure modes based on results
Lead design reviews with cross-functional teams to ensure they meet project requirements as well as regulatory & industry standards
Support production launch activities and continuous products & process improvements
Help support both on-site & off-site troubleshooting activities with our Production Support &/or the Customer Care teams when necessary
Lead Root Cause Analysis (RCA) efforts and advise stakeholders on technical issues that could affect product design and delay deliverables
Perform other duties, as required
REQUIREMENTS
Bachelor’s Degree in Engineering
Minimum 5 years of progressive engineering experience
Direct experience with:
Designing High Voltage (HV) systems which includes appropriate cable sizing, connector selection, circuit protection, cable routing & retention, meeting creepage & clearance tolerances, as well as EMC shielding
Electrified vehicles and related HV componentry such as DC/DC converters, electric traction motors, Li-ion batteries, high-power DC chargers, etc.
DC fast charging (DCFC), overhead (pantograph) charging, &/or inductive (wireless) charging
EMC emission and immunity test methods such as CISPR 25, ISO-11452-2, ISO 7637-4, & ISO 10605
Diagnosing and troubleshooting electrical systems using basic tools such as a function generator, multimeter, oscilloscope, hi-pot tester, megger ohm meter, etc.
Familiarity with:
Manufacturing environment & processes
Heavy-duty vehicles
ECAD software such as Zuken E3, Mentor Graphics, &/or AutoCAD Electrical
Standard methodologies such as 8D, five whys, & fishbone diagrams to help root-cause complex issues
SAE electric vehicle charging standards such as J19772, J3105, J2954, etc.
Industry standards such as FMVSSS, NHTSA, DOT, MFPA, SAE, NEC, etc.
ABOUT THE ENVIRONMENT
Ability to lift up to 25 lbs.
Working environment is primarily indoors (office and production environment), however, at times may require time spent outdoors
Regularly required to sit, stand, and walk; occasionally kneel or squat
May be required to work overtime based on business needs
Limited domestic travel
Early schedule with typical start time 6AM (negotiable)"
24,Construction Inspector Specialist - Construction Inspector IV,City of Tampa,"Tampa, FL",Onsite,"$64,085 - $115,606 ",r - Full-time,"Nature Of Work
Employees in this class are responsible for performing highly technical inspections of residential and commercial structures and construction sites to ensure conformance with approved plans and state/municipal codes, regulations, and ordinances.
Employees in the class work under the license of the Building Official for a one (1) year period while training and preparing to obtain a minimum of one (1) of five (5) state inspector licenses. Tasks are of more than average difficulty, requiring employees to possess considerable knowledge and expertise in: building construction and related site work; plumbing, electrical and mechanical installations; inspection procedures; and associated codes. Work involves the inspection of residential and commercial buildings which are under construction or being repaired, remodeled or enlarged and is performed during various stages of completion to ensure structural integrity and compliance with building codes and ordinances. An important aspect of this work is prevention of pollution or contamination of water and sewer facilities in order to protect the health of the community being served by these facilities.
Employees must exercise extreme caution in performing mechanical inspections because work is conducted in proximity to equipment operating at hazardous high pressures, temperatures, and voltages. Reasonable initiative and independent judgment are required in determining whether changes are needed in plans and in making recommendations to contractors, engineers, architects, etc. Accurate, complete, and current inspection records are maintained to provide supporting documentation, particularly when approval is not given, a violation is determined to exist, or a project plan must be modified. An employee must exercise tact and courtesy when conducting inspections, in the resolution of inspection problems, and in the explanation of code content or its interpretation to the general public, contractors, engineers, builders, and owners. Employees operate lightweight motor vehicles to travel among work locations and perform tasks requiring moderate exertion, including climbing ladders, scaffolds, etc. Work is performed under general supervision and reviewed through observation, conferences, and inspection reports submitted.
Examples of Duties
Based on Licensure Type, inspectors perform required inspections of foundations, concrete slabs, beams, pilasters, steel placement, framing, insulation, roofing, and related construction work; performs inspections of mechanical, electrical, plumbing, gas and solar energy equipment and systems as well as site construction (zoning, tree/landscaping, transportation and stormwater features); determines safety of installation, adequacy of capacity, durability of materials, and compliance with code; orders a cease in operations if installations or operations do not conform to applicable codes or if proper licenses and permits are not obtained; conducts final inspection for Florida Residential Code and Land Use Code Compliance prior to issuance of Certificate of Occupancy or completions.
Conducts inspections to ascertain compliance with flood control ordinances; inspects the placement, height, foundation, set back.

Evaluates type, condition, life expectancy of trees and conflict with utilities and structures for possible removal or corrective action; inspects construction sites for tree protection, evaluates proper root pruning; interprets plans and inspects site for quality and quantity of planted materials for residential and commercial construction projects; performs periodic unscheduled tree barricade inspections.

Conducts compliance inspections for driveway aprons, curbing, sidewalks; evaluates right-of-way for sight obstruction hazards; ensures barricades and safety signage are properly located.

Inspects on-site culverts, control structures, headwalls, pipe tie-ins, mitered end sections, retention ponds, infiltration systems, vaults, installation of underground stormwater pipe, inlets, and manholes for commercial and residential construction projects; safeguards Environmental Protection Code (EPC) protected wetlands by assuring installation and maintenance of silt barriers along jurisdictional wetland lines; ensures correct size and location, spacing, and placement of wall forms.

Investigates complaints regarding code and permit violations and faulty work; determines if a violation or hazard exists; notifies owners or contractor that corrective action must be taken; issues citations and presents complaint cases to judicial boards as necessary; ensures completion of corrective action.

Researches and organizes files; extracts data from reports; maintains inspection records; prepares inspection reports as well as completes time sheets; performs mathematical calculations for work projects.
Reads and interprets plans and specifications to facilitate proper construction methods, etc.; examines construction documents to determine conformity with applicable building and related regulations; contacts developers to obtain required documentation.

Identifies hazardous conditions or accident potential to facilitate prevention and/or correction; conducts equipment inspections for adherence to safety standards; checks all emergency repairs and decides what action should be taken; performs damage assessment and habitability inspections of both commercial and residential buildings as part of the City’s emergency response and recovery responsibilities.

Interprets codes and regulations for, consults with, and advises engineers, architects, contractors, builders, owners, and other concerned parties, both orally and in writing.

Interprets and summarizes regulatory agency requirements and recommends appropriate action; keeps others abreast of changes to content and interpretation of codes for proper enforcement; participates in meetings, public workshops, and seminars to gather, present, and distribute information.

Evaluates various water and gas meters and notifies companies of malfunctions and necessary repairs. Coordinates work with Wastewater and Water Departments to ensure proper connection to city facilities; coordinates installation of wells and septic tanks with Southwest Florida Water Management District and Hillsborough County Health Department.

Operates and maintains portable computer/printer and photographic equipment as part of mobile data system; inputs permit, plans and inspection data, utilizes email and internet programs, and utilizes word processing, mapping and other application software.

Performs related work as required.
Knowledge, Skills & Abilities
Considerable knowledge of: principles and practices of building design and construction; landscaping, transportation and stormwater methods, practices, and materials; building and site codes, standards and ordinances; building and inspection procedures, practices, and methods.

Working knowledge of: the layout of the City and its geography; computer equipment and software.

Ability to: read, interpret, and work from construction plans, blueprints, and schematics; enforce applicable codes and ordinances with firmness, impartiality, and tact; follow oral and written instructions; prepare and submit clear and concise written reports; perform work requiring moderate physical exertion, including climbing ladders; operate a lightweight motor vehicle; establish and maintain effective working relationships with other employees, the construction industry, utilities and the general public.

Skill in: the use and maintenance of building and site construction testing equipment, electronics including cell phones, laptops and computers.
Minimum Qualifications
Graduation from an accredited high school or vocational school and pursuant to Florida Statue Section 468.609, four (4) years of experience in building and site construction practices.

Additional requirements for higher levels:

Inspector I - IV: Preferred qualifications include two (2) years college level course work in construction, engineering, architecture or related field.

Construction Inspector II, III and IV : one (1) year of experience in application of municipal and state codes, laws, rules and regulations.
Licenses or Certifications
All Levels
a valid Florida driver’s license
Inspector Specialist: Must obtain one (1) Florida Standard Inspector License (Building, Mechanical, Electrical, Plumbing or One & Two Family Dwelling – FS 468) within one (1) year of employment. Site Inspectors must obtain the Florida Floodplain Managers Certification within one (1) year of employment.

Inspector I: Must possess one (1) Florida Standard Inspector Licenses (Building, Mechanical, Electrical, Plumbing or One & Two Family Dwelling – FS 468)

Inspector II: Must possess two (2) Florida Standard Inspector Licenses (Building, Mechanical, Electrical, Plumbing or One & Two Family Dwelling – FS 468)

Inspector III: Must possess three (3) Florida Standard Inspector Licenses (Building, Mechanical, Electrical, Plumbing or One & Two Family Dwelling – FS 468)

Inspector IV: Must possess four (4) Florida Standard Inspector Licenses (Building, Mechanical, Electrical, Plumbing or One & Two Family Dwelling – FS 468).

Note: Applicants selected for employment must place their Contractor’s License on inactive status with the State immediately upon employment.
Examination
Evaluation of education and experience. Drug testing is included in all pre-employment processing.
Comments
Employees may be required to work rotating shifts, including nights, weekends, holidays and overtime as needed. During periods when the Mayor issues an emergency declaration for the City of Tampa, all employees may be required to work in preparation, response or recovery activities related to the stated emergency."
25,High Voltage Operations Engineer,Duke University,"1600 Erwin Rd, Durham, NC 27705",Onsite,"$72,211 - $115,260 ",r - Full-time,"High Voltage Operations Engineer
BACKGROUND
Duke Utility & Engineering Services (DUES) includes the following operating units that provide the full range of utility & engineering services to the Duke Campus and Medical Center: Chilled Water, Steam, Electrical HV Systems, Water (including water, sewer, and storm water), Energy Management and Engineering. The Electrical HV Systems organization is responsible for installation, maintenance, and operation of the high voltage distribution system, central emergency power generation systems and the campus site lighting. DUES is within the Facilities Management Department (FMD) that reports to the Vice President for Facilities Services. This position reports to the High Voltage System Manager.
RESPONSIBILITIES
The HV Operations Engineer is responsible for the management and oversight of the operation, maintenance and construction team within the Electrical HV Systems organization. Responsibilities also include the development of design standards, PM programs and system SOPs. The HV Operations engineer will also own the both the distribution and generation system renewal programs.
Typical Duties
Responsible for a growing team of 15+. Direct management of HV Supervisor and future administrative staff to support team growth.
Coordinate the design, procurement, and construction of new high voltage distribution systems to meet the needs of new or renovated facilities.
Review HV electrical plans, specifications and equipment for new installations and renovations; inspect projects during and following installation and advise as to compliance with specifications prior to University acceptance.
Assist in the development and updates of the University standards and guidelines for future project planning, design, construction and maintenance activities to insure best practices are employed.
Advise and assist with problems involving electrical engineering and maintenance.
Prepare complex switching procedures.
Assist in operation, maintenance and design of medium voltage generation equipment and paralleling switchgear.
Prepare and develop Preventative Maintenance programs for power distribution and generation equipment.
Prepare reports, analyses, and presentations as needed.
Perform other related duties incidental to the work described herein.
The above statements describe the general nature and level of work being performed by individuals assigned to this classification. This is not intended to be an exhaustive list of all responsibilities and duties required of personnel so classified.
PROFESSIONAL QUALIFICATIONS (preferences)
Education and Experience
B.S. degree in Electrical Engineering and 5 years experience or an equivalent combination of relevant education and/or experience skills.
Preferred 3 years experience supervising technical staff
Knowledge, Skills, and Abilities
Experience with operation and maintenance of 15kV switchgear, generators, and underground distribution systems.
High level of organizational planning, teamwork, analytical reasoning skills including data analysis techniques and statistical interpretation skills
Basic knowledge of site lighting systems.
Knowledge of the National Electrical Code (NFPA 70E)
Knowledge of SCADA systems
Experience with SKM circuit analysis software or similar
Ability to create and maintain positive customer and stakeholder relationships.
Microsoft Office skills including Word, Excel and PowerPoint
CAD drafting skills utilizing AutoCAD
Minimum Qualifications
Education
Work requires a Bachelor's degree in a specific engineering field related to construction (e.g. Civil Engineering, Electrical Engineering, Mechanical Engineering) and eligibility for North Carolina licensure as an Engineer.
Experience
Work requires a minimum of three years experience in design, planning, OR AN EQUIVALENT COMBINATION OF RELEVANT EDUCATION AND/OR EXPERIENCE evaluation and project management related to new construction and renovation of buildings and/or systems.
Job Type: Full-time
Pay: $72,211.00 - $115,260.00 per year
Benefits:
401(k) matching
Dental insurance
Employee discount
Flexible spending account
Health insurance
Life insurance
Paid time off
Parental leave
Retirement plan
Tuition reimbursement
Vision insurance
Schedule:
8 hour shift
Ability to commute/relocate:
Durham, NC 27705: Reliably commute or planning to relocate before starting work (Preferred)
Work Location: One location

Health insurance"
