,Title,Company,Location,Type,Salary,Contract_type,Job Description
11,Engineer (Lighting) - Entry Level,Intertek,"Plano, TX",Onsite,Full-time,Full-time,"Intertek, a leading provider of ATIC (Assurance, Testing, Inspection, and Certification) Services, is looking for Recent Grad's / Entry Level Engineers to join our Electrical team in Plano, TX .
Position Overview
The Engineer is responsible for performing testing and evaluation on a variety of products to the provisions of U.S., Canadian and other international product safety standards; writing reports; and communicating with clients. Under the guidance of a more senior Engineer, may also conduct on and off-site evaluation of products to determine compliance with applicable standard(s).
Job Responsibilities
Under the guidance of a more senior engineer, conduct on and off-site evaluation of products to determine compliance with applicable standard(s). To do this, Engineer must:
Read and determine applicability of national codes and standards clauses for the EUT (equipment under test);
Under scope of the project, identify and locate test instruments and equipment required for testing;
Set up and operate EUT; perform and document simple repairs on EUT as needed;
Perform testing of products in accordance with standards. Core tests include, but are not limited to: rating, leakage current, dielectric, temperature, pressure, stability, mechanical hazard, flammability, abnormal and fault insurance, rain, radiation, sound, laser.
Complete preliminary design reviews (PDR) both on and off site.
Set up and operate standard test equipment including, but not limited to, spectrum analyzer, oscilloscope, multi-meter, dielectric strength tester, ground continuity tester, digital multi-meter, surge generator, over-voltage tester, environmental condition chamber, articulated probes. Use hand tools to build/calibrate test fixtures.
Compile test results during construction review and testing. Compile data and product description and type final report using established report shell. Submit report to reviewer for final approval.
Communicate project status and test results to client, sales personnel, and management throughout testing. Provide on-going support to clients as needed.
Perform other work as required
Needed Knowledge, Skills, and Abilities
Bachelor’s degree in Electrical or Mechanical Engineering, required
May '23 grad welcome to apply
0+ directly related experience
Working knowledge in electrical circuit design/analysis principles.
Ability to interpret an extensive variety of technical instructions in mathematical or diagram form and deal with several abstract and concrete variables
FE preferred
Demonstrated experience with U.S., Canadian, and other International product safety standards, i.e., ANSI, CSA, UL, EN, IEC is a plus
Excellent organization and time management skills
Excellent customer service skills
Must be self-motivated and able to work independently in a fast-paced, multi-tasking environment
Prior project management experience is a plus
Microsoft Office expertise
Ability to travel as business needs dictate, up to 25%
Why Work at Intertek?
Intertek is a world leader in the $250 billion Quality Assurance market, with a proven, high-quality business model and a global network of customer-focused operations and highly engaged subject matter experts. At Intertek, we exercise our spirit of innovation, the passion of our people and our unmatched customer commitment to realize our purpose of making the world an ever better, safer, and more sustainable place for all. Learn more about Our History and What We Do .
Intertek is committed to a safe work environment for our employees and clients. Learn more about our COVID-19 Policy .
What we Have to Offer
When Working with Intertek , you can expect salary and benefit package competitively placed within the local market, including
Fully comprehensive benefits package; Medical, Dental, Vision, Life, and Disability
401(k) with company matching
Competitive market pay
Employee referral bonus
Discounted prices on travel, merchandise, auto purchases
Tuition reimbursement and much more
Intertek is a drug-free workplace. As a condition of employment, all hires are required to pass a pre-employment drug test.
Intertek believes that Our People are our strongest tool for success. We are an Equal Opportunity Employer and do not discriminate against applicants due to veteran status or on the basis of disability. All qualified applicants will receive consideration for employment without regard to race, color, religion, sex, national origin, sexual orientation, or gender identity.
For individuals with disabilities who would like to request an accommodation, or who need assistance applying, please email hr.eeoc.data@intertek.com or call 1-877-694-8543 (option #5) to speak with a member of the HR Department.
CA-GR
#LI-GR1

Intertek is a leading Total Quality Assurance provider to industries worldwide. Our network of more than 1,000 laboratories and offices in more than 100 countries, delivers innovative and bespoke Assurance, Testing, Inspection and Certification (ATIC) solutions for our customers' operations and supply chains. Working at Intertek means joining a global network of state-of-the-art facilities and passionate people who deliver superior customer service with a purpose of bringing quality, safety, and sustainability to life."
12,Engineering Technician C - (Electrical Testing-high voltage),L3Harris Technologies,"Anaheim, CA",Onsite,"$56,500 - $104,500 ",r,"Description:
Job Title: Engineering Technician C – 1st shift (Electrical Testing-high voltage)
Job ID: IMS20232002-97408
Job Location: Anaheim, CA
Job Schedule: 9/80 work schedule
Job Description:
The Engineering Technician will utilize electrical engineering skills to aid in the integration, test and development of all engineering prototype assemblies, while working closely with the Sr. Test Engineers, Design Engineers and Project Engineers. This includes preparation of test and trouble reports under minimal supervision.
The Engineering Technician is a key member involved in all Test facets of an Engineering development project including; proposal preparation, design reviews, test plans, top/sub assembly test procedures, integration, Qualification test procedures and testing, Environmental testing, failure analysis, and test facilities and equipment. The ability to work with minimum oversight by supervisors is expected, as the Engineering Technician may be assigned to Engineering teams in addition to teams within the Technical Support group.
ESSENTIAL DUTIES AND RESPONSIBILITIES include the following. Other duties may be assigned.
Write detailed test procedures as needed to support the test group in performing testing.
Follow all Safety requirements.
Follow all Quality requirements.
Ensure Good Engineering Practices are followed.
Work/upgrade drawings, parts lists, Engineering Orders, wiring lists, diagrams, and schematics.
Interface with engineering personnel assigned to the project.
Performs other duties as assigned by Management.
QUALIFICATIONS:
Requires a High School Diploma or equivalent and a minimum of 6 years of prior relevant experience or 2 years post-Secondary/Associates Degree with a minimum of 2 years of prior related experience.
Must have Three (3) to five (5) years related experience and/or training in an Egineering testing/support role.
Must have mechanical aptitude to evaluate mechanical design and fit of modules for good engineering practices.
Must have good hands-on experience setting up test instrumentation.
Knowledge of drawings, parts lists, Engineering Orders, wiring lists, diagrams, schematics and failure analysis.
Extensive knowledge of related test equipment used to test power and digital systems, e.g. DSO, Power meter/analyzer, network analyzer, and logic analyzer.
Knowledge of and experience with Lockout/Tagout (LOTO) processes and practices, and the use of proper PPE around energize electrical equipment.
Excellent ability to troubleshoot to component level and identify Root Cause of Failure.
Preferred Additional Skills:
One (2) to two (5) years experience performing Qualification testing for military programs is preferred.
Experience with low and medium voltage power systems is highly desirable.
Knowledge and good understanding of Thermodynamics is highly preferred.
Possess good problem-solving skills to address engineering Program issues.
Ability to communicate effectively to multiple groups and provide concise reports or status information for project review and milestone achievement.
LANGUAGE SKILLS:
Ability to read and interpret English language documents such as safety rules, operating and maintenance instructions, and procedure manuals. Ability to speak effectively before groups of customers or employees of organization.
MATHEMATICAL SKILLS:
Ability to add, subtract, multiply, and divide in all units of measure, using whole numbers, common fractions, and decimals. Ability to compute rate, ratio, and percent and to create and interpret various graphs to display a number of performance issues such as metrics, schedule, and earned value.
REASONING ABILITY:
Ability to apply problem-solving techniques to carry out instructions furnished in written, oral, or diagram form. Ability to deal with problems involving several concrete variables in standardized situations. Ability to recognize and report any unsafe working conditions.
PHYSICAL DEMANDS:
The physical demands described here are representative of those that must be met by an employee to successfully perform the essential functions of this job. Reasonable accommodations may be made to enable individuals with disabilities to perform the essential functions.
While performing the duties of this job, the employee is regularly required to use hands to finger, handle, or feel; reach with hands and arms; and talk or hear. The employee frequently is required to sit. The employee is occasionally required to stand; walk; climb or balance; and stoop, kneel, crouch, or crawl. The employee must regularly lift and/or move up to 10 pounds, frequently lift and/or move up to 25 pounds, and occasionally lift and/or move up to 50 pounds. Specific vision abilities required by this job include close vision, distance vision, color vision, peripheral vision, depth perception, and ability to adjust focus.
In compliance with pay transparency requirements, the salary range for this role is $56,500.00 - $104,500.00. This is not a guarantee of compensation or salary, as final offer amount may vary based on factors including but not limited to experience and geographic location. L3Harris also offers a variety of benefits, including health and disability insurance, 401(k) match, flexible spending accounts, EAP, education assistance, parental leave, paid time off, and company-paid holidays. The specific programs and options available to an employee may vary depending on date of hire, schedule type, and the applicability of collective bargaining agreements."
13,"Low Voltage, IT Engineer",JB&B,"New York, NY",Hybrid remote,"$75,000 - $82,000 ",r - Full-time,"Who We Are
Jaros, Baum & Bolles (JB&B) is a MEP engineering firm headquartered in New York City with additional offices in Boston and Philadelphia. For over 100 years, JB&B has leveraged cutting-edge technologies with sound engineering practices to create building designs that have transfigured the skyline, reimagined healthcare, and brought us closer to a sustainable, low-carbon future.
We foster a collaborative, high-performing culture in which our employees share the common goal of creating a progressive, inclusive and fun work environment. JB&B values the voices and opinions of our employees. We are a team. We are a community.
About the Role
JB&B is seeking to add a qualified, confident, and collaborative IT Engineer to our Low Voltage Department in our New York office. This is an entry-level role with an anticipated start date in June 2023.
Engineers are afforded with a wide breadth of project types, varying in size, duration, and complexity and the opportunity to professionally develop through our JB&B University training program. Engineers provide our clients with exceptional service and are competent in the engineering principles and design methods and are capable in performing both technical and non-technical responsibilities including research, analysis, design and documentation.
The ideal candidate will be driven to learn new skills and will be capable of performing technical and non-technical responsibilities including research, analysis, design and documentation. At JB&B, you will have the opportunity to work closely with senior leaders including Partners on our client projects.
Responsibilities
Designs technology room fit-out and coordination of MEP elements within technology rooms
Performs all calculations including cable conduit fill, heat loads, and power receptacle requirements for technology equipment
Assembles and understands riser diagrams, schedules, floor plans
Plans and coordinates routing of major distribution
Qualifications
Bachelor’s degree in Engineering, Computer Science, Information Technology, or similar major.
0-2 years of experience
Possess relevant experience through internships and coursework
Experience with applicable design software tools preferred (Revit and AutoCAD)
Basic understanding of the electrical coordination required with other trades
What We Offer
Our employees are our greatest strength. We invest in our people and support their needs.
Hybrid workplace offering the flexibility to work both from home and the office.
Comprehensive benefits package including 401k employer match.
Paid time off (PTO), paid parental leave and inclusive holidays.
Training and professional development courses through JB&B University.
Multiple employee resource groups.
Volunteer program.
Estimated compensation: $75,000-$82,000 a year
Jaros, Baum & Bolles is an equal opportunity employer. All qualified candidates will receive consideration for employment without regard to race, ethnicity, color, religion, sex, sexual orientation, gender identity, national origin, age, disability, marital status, military veteran status, unemployment status, or any other status protected by law.
Hbd9Fi1yGh"
14,"Manager, High Voltage Charging and Distribution",Zoox,"Foster City, CA",Onsite,"$177,000 - $294,000 ",r - Full-time,"As the Manager of High Voltage Charging and Distribution at Zoox, you will be leading a team of system engineers responsible for the design, development, and production of the onboard charging hardware and depot infrastructure specifically tailored for our autonomous mobility service. You will work with engineering leaders across hardware, software, product, IT, infrastructure, procurement, finance, vehicle engineering, and various suppliers to develop project schedules, identify milestones, flag risks, estimate budgets, and clearly communicate ongoing progress cross-functionally.
Responsibilities
Develop, deploy and improve the technology development processes and functions for the company within the charging and infrastructure domain
Lead technical design review of build to specification and build to print components and subsystems
Timely containment and resolution of technical issues
Review and approve requisite documentation (reports, BOMs, drawings, test reports, etc)
Mentor, train, and develop engineers
Approval of budget, resource planning, and scheduling
Update job knowledge by remaining current on codes and requirements; participating in educational opportunities; reading professional publications; maintaining personal networks; and participating in professional organizations
Qualifications
BS or MS in an engineering discipline or equivalent experience (ME, EE, or Mechatronics)
Experience: 8+ years of engineering plus 4+ years of people management
Deep technical knowledge of electric vehicle subsystems including design, modeling and simulation, manufacturing, materials, chemistries, and electronics
Demonstrated release of hardware products that depend on firmware/software
Hardware and software integration experience: project planning, bring-up, deploy and sustaining
Track record in managing complex cross-functional projects
Demonstrated ability to keep the big picture in focus and to provide clear, well-structured, and concise communications tailored to each appropriate audience
Tools: JIRA, Confluence, Polarion, Google Suite, 3DX, Reliasoft
Bonus Qualifications
Experience with automotive functional safety (ISO26262) standards, EE HW reliability life calculations, and system FMEA analysis
Experience with automotive EE system-level communication (CAN, LIN)
Understanding of Lithium-Ion degradation and failure modes/mechanisms
Understanding concepts of electromagnetic compatibility/interference
Six Sigma training or specific problem-solving methodologies (PPS, A0, 8D, etc)
Compensation
There are three major components to compensation for this position: salary, Amazon Restricted Stock Units (RSUs), and Zoox Stock Appreciation Rights. The salary range for this position is $177,000 to $294,000. A sign-on bonus may be offered as part of the compensation package. Compensation will vary based on geographic location and level. Leveling, as well as positioning within a level, is determined by a range of factors, including, but not limited to, a candidate's relevant years of experience, domain knowledge, and interview performance. The salary range listed in this posting is representative of the range of levels Zoox is considering for this position.

Zoox also offers a comprehensive package of benefits including paid time off (e.g. sick leave, vacation, bereavement), unpaid time off, Zoox Stock Appreciation Rights, Amazon RSUs, health insurance, long-term care insurance, long-term and short-term disability insurance, and life insurance.
Vaccine Mandate
Employees working in this position will be required to have received a single dose of the J&J/Janssen COVID-19 vaccine OR have completed the two-dose Pfizer or Moderna vaccine series. In addition, employees will be required to receive a COVID-19 booster vaccine within two months of becoming eligible for the booster vaccine.

Employees will be required to show proof of vaccination status upon receipt of a conditional offer of employment. That offer of employment will be conditioned upon, among other things, an Applicant’s ability to show proof of vaccination status. Please note the Company provides reasonable accommodations in accordance with applicable state, federal, and local laws.

About Zoox
Zoox is developing the first ground-up, fully autonomous vehicle fleet and the supporting ecosystem required to bring this technology to market. Sitting at the intersection of robotics, machine learning, and design, Zoox aims to provide the next generation of mobility-as-a-service in urban environments. We’re looking for top talent that shares our passion and wants to be part of a fast-moving and highly execution-oriented team.

Follow us on LinkedIn

A Final Note:
You do not need to match every listed expectation to apply for this position. Here at Zoox, we know that diverse perspectives foster the innovation we need to be successful, and we are committed to building a team that encompasses a variety of backgrounds, experiences, and skills."
15,Electrical Engineer,Inductotherm Corp.,"Rancocas, NJ 08073",Onsite,Full-time,Full-time,"Benefits:
Sign-On Bonus
Monthly Incentive Bonus
Profit Sharing Plan
Health/Dental/Vision within 30 days
Tuition Assistance
And Many More!
Electrical Engineer
The Electrical Engineer is responsible for designing and releasing for production induction power supplies, transformers, power transmission systems and other ancillary equipment. Experience with high voltage equipment is preferred.
Education:
BSEE or MSEE with a concentration in Electrical Circuits, Power Systems, Power Electronics. 3-5years’ experience in designing electrical systems. EIT or PE, a plus.
Essential Functions:
Electrical discipline skills: Electrical circuits, Power systems, and Power electronics.
Mathematic skills: Calculus, numerical methods, differential equations.
Computer skills: AutoCAD/SolidWorks, Spreadsheets.
Familiar with test equipment and able to use volt meter and oscilloscope.
Able to read and understand electrical schematics.
Able to manage multiple projects simultaneously.
Work well under pressure and tight deadlines.
Strong communication and follow-up skills.
Work independently and exercise good judgment
Strong presentation skills and ability to interact with all levels of management.
Always maintain a safe working environment for oneself and others.
Able to travel domestically and internationally, as required.
Experience in the field of electromagnetics.
Will be responsible in handling and care of equipment and tools.
Will handle miscellaneous duties as assigned.
Essential Physical Requirements:
The physical demands described here are representative of those that must be met by an employee to successfully perform the essential functions of this job.
Able to traverse the floor of a plant in an industrial setting with various types of heavy machinery and overhead hoists in operation.
Have a valid driver's license and able to drive an automobile.
Able to wear appropriate PPE (Personal Protective Equipment)
Must disclose any surgical implants, pins, braces or other devices that could be affected by induction fields.
Reasonable accommodations may be made to enable individuals with disabilities to perform the essential functions.
Condition of Employment:
Must be able to satisfactorily complete the Inductotherm Corp. hiring process requirements which includes a comprehensive assessment, drug testing, and a background check. This is a 100% on site position.
Inductotherm Corp. is a Drug Free Environment.
Inductotherm Corp. is an Equal Opportunity employer of qualified individuals and does not discriminate on the basis of race, color, religion, sex, national origin, age, disability, veteran status or any other basis protected by applicable federal, state or local law. Inductotherm Corp. also prohibits harassment of applicants or employees based on any of the protected categories.
Job Type: Full-time
Benefits:
401(k)
Dental insurance
Employee discount
Health insurance
Life insurance
Paid time off
Referral program
Retirement plan
Tuition reimbursement
Vision insurance
Schedule:
8 hour shift
Monday to Friday
Ability to commute/relocate:
Rancocas, NJ 08073: Reliably commute or planning to relocate before starting work (Required)
Work Location: In person

Health insurance"
